Text,date
EASTER COMPETITION TIME You could win £ Amazon voucher taking part Easter Competition Just fin ,4/8/2019 15:35
jcump TCSBB Sorry I missed weekend Hope went well,4/8/2019 15:35
Gregory Esayan feat Angel Falls Part Me Original Mix PART OF ME Beatport NowPlaying,4/8/2019 15:35
Interested Organizations ask send PPT project KPMGIndia DeloitteUS TCS NandanNilekani ,4/8/2019 15:33
Ripple Indian Multinational IT Service TCSs Payment Solution Likely Runs RippleNet ,4/8/2019 15:32
Gregory Esayan The Best Gift Original Mix MY GUIDING STAR Beatport NowPlaying,4/8/2019 15:28
RippleXrpie I started contractor position TCS back March There Indian guys work ar ,4/8/2019 15:28
I looking powerful Organization implement project Orgns like KPMGIndia DeloitteUS TCS ,4/8/2019 15:27
tryna rude I aint gonna stream love give money tcs I wanna support sos Ill strea ,4/8/2019 15:25
How prevent CX getting skewed silos amp illtimed interactions Read blog know best practices arou ,4/8/2019 15:25
New RippleNet Partner TCS Bringing Important Clients To Ripple Net xrpcommunity  via YouTube,4/8/2019 15:24
Quickly easily provision simplified data lake AWS Marketplace TCS Connected Intelligence Data Lake ,4/8/2019 15:23
Gregory Esayan One Look Original Mix MY GUIDING STAR Beatport NowPlaying,4/8/2019 15:21
Lean business stakeholders reduce dependence IT data analytics quickly easily provi ,4/8/2019 15:21
EASTER COMPETITION TIME You could win £ Amazon voucher taking part Easter Competition Just find ,4/8/2019 15:20
Cant wait Canadian Export Challenge event Vancouver May StartupCanada UPSSmallBizCA ,4/8/2019 15:18
HyghWilliam gregdoucette Transfered tech college private university I know friends however ,4/8/2019 15:16
TCS kindly help us TCS tcsEngiNx,4/8/2019 15:14
Deishma If manages high led Reliance INFYTCS Tata Motors INFY closed ,4/8/2019 15:13
shahrukhsyed Tcs ho jao giUFUF,4/8/2019 15:11
SimplyCharlie I hate like request say yet dont play damn song I dont kn ,4/8/2019 15:11
TCS breakout points ,4/8/2019 15:07
Gregory Esayan My Guiding Star Original Mix MY GUIDING STAR Beatport NowPlaying,4/8/2019 15:06
senwarren please help give TCs dispatchers recognition deserve supporting Rep ,4/8/2019 15:05
SenMarkey please help give TCs dispatchers recognition deserve supporting Rep ,4/8/2019 15:04
TCS came via mail saying qualified second stage discrepancy ,4/8/2019 15:04
repmcgovern please help give TCs dispatchers recognition deserve supporting Rep ,4/8/2019 15:04
RRECCDISPATCH RepMcGovern NormaJTorres RepBrianFitz NENA repmcgovern please help give TCs di ,4/8/2019 15:04
Wow lot got dumped TCs weekend damn Dont take spouses ok,4/8/2019 15:04
RRECCDISPATCH SenMarkey NormaJTorres RepBrianFitz NENA SenMarkey please help give TCs dispat ,4/8/2019 15:03
The UofM scholars share necessity white TCs practice racial literacy ex white TCs practice ,4/8/2019 15:03
RT AppJavelin Cant wait Canadian Export Challenge event Mississauga June StartupCanada UPSSmallBizCA ExportD,4/8/2019 15:01
Get Your Wings w Dean Thoroughbred Select Quilt Top Trans Cherry Sunburst UF ,4/8/2019 15:01
Youre golden spot biggest egg Clue Dont get square eyes searching egg cityc ,4/8/2019 15:00
Gregory Esayan Innerspace Dan amp Sam Intro Mix SILK REMIXED Beatport NowPlaying,4/8/2019 14:57
UFCEASTER COMPETITION TIME UFC You could win £ Amazon voucher taking part Easter Competition Just find ,4/8/2019 14:57
Disrupted copper scrap flows weigh copper concs TCs CESCO ,4/8/2019 14:57
TCS Arch Summit  arch,4/8/2019 14:57
Tata Consultancy Services TCS reported consolidated revenues  billion year ending March ,4/8/2019 14:56
Alamgir khan AKFixit iFixit Inbox order UF MasterPiece UFDUFD Pencilsketch UFC workondemandUF Delivery Avai ,4/8/2019 14:56
Quarterlyfilers file refund applications monthly New window enabled claiming TDSTCS credits Respond ,4/8/2019 14:55
RT denisewills Shes black female prosecutor racist misogynist possibly criminal president All caretaking,4/8/2019 14:53
RT KamalaHarris We need president recognizes white nationalist extremism national security threat  willing spe,4/8/2019 14:53
Almost paid teams triplecrownspts Border Wars Rocky Mount NC weeks Dont miss This ,4/8/2019 14:52
TCS Arch Summit  arch,4/8/2019 14:51
LondonMarathon TCSUKI Does app work Have downloaded play store I open app stops working immediately,4/8/2019 14:51
EASTER COMPETITION TIME You could win £ Amazon voucher taking part Easter Competition Just find ,4/8/2019 14:50
Tata Consultancy Services TCS reported consolidated revenues  billion year ending March ,4/8/2019 14:49
Gregory Esayan Interdependent Original Mix MY GUIDING STAR Beatport NowPlaying,4/8/2019 14:49
Cant wait Canadian Export Challenge event Mississauga June StartupCanada UPSSmallBizCA ,4/8/2019 14:49
RT CattleBaronTVB Over many years hamburgers become favourite throughout world Many food outlets South Africa compete,4/8/2019 14:48
KarenKennedyTCS premiumshell EastCoastsfd CanadianBeef TCSSDC TCSRefreshSDC MLevinCdaSpain SaboresdeCanada ,4/8/2019 14:48
anandmahindra TCS No offence Sir Anand Mahindra everything smooth cake F ,4/8/2019 14:47
RT TCSEurope For sixth year row TCS named highest ranking IT services company customer satisfaction Europ,4/8/2019 14:47
Global IT Giant TCS Adopts RippleNet TCS services CitiBank UK General Electric Microsoft name TCS ,4/8/2019 14:47
Sabrina Ionescu return Oregon senior year gtgt  ,4/8/2019 14:41
TCS Arch Summit  arch,4/8/2019 14:41
A data dig umpire accuracy balls strikes happens next gtgt  ,4/8/2019 14:36
RT KTAR A commercial real estate firm leased square feet office space former Mortons The Steakhouse building ,4/8/2019 14:35
A commercial real estate firm leased square feet office space former Mortons The Steakhouse buil ,4/8/2019 14:35
passportsevamea TCS passport Bihar Saran Chapra PSK office internet connection delaying ,4/8/2019 14:34
Join Team Canada UFEUFE Canadas GlobalEntrepreneur Cohort w UPSSmallBizCA ExportDevCanada amp TCSSDC ,4/8/2019 14:30
UFEAeromart Montreal DYK Morocco UFFUFE guest honor Come workshop Monday April p ,4/8/2019 14:27
RONAISSANCE SKEESWORLD Lmao lackluster could super Cuban could super Hawaiian could tcs coul ,4/8/2019 14:27
RT TCS Business  behavior principles spell success Leaders organizations adopted four critical behaviors,4/8/2019 14:27
Ripple Partners Multinational IT Giant Tata Consultancy Service TCS Further Pushing RippleNet Expansion It ,4/8/2019 14:25
TCS Healthcare Technologies Releases ACUITYnxt  ,4/8/2019 14:18
RT kylegriffin Pete Buttigieg The struggle transgender troops ready put lives line country,4/8/2019 14:18
Ripple XRP Partner Indian IT Giant TCS Ties Major Bank Positive Effects XRP Expected ,4/8/2019 14:18
RT aaustralia Here TCS Ripplenet  ,4/8/2019 14:16
Today I learnt new situation A farmer reservation classified poor farmer Son works TCS good sa ,4/8/2019 14:14
porpeeka GirlWrites I cleaned bottom kept cheeks chin I think Ill keep awhile ,4/8/2019 14:13
YayvoTCS Contact Punjab University UFUF,4/8/2019 14:12
RT RaoSumukh Basically colleges polite way saying doesnt matter branch study placement toh TCS hi hoga ,4/8/2019 14:12
anandmahindra TCS It could made much efficient find better alternative police verificatio ,4/8/2019 14:08
RT NYinLA This best minutes seconds see today You personal guarantee ,4/8/2019 14:05
TCS Truism Great selling involves helping people make great buying decisions ,4/8/2019 14:02
ExaammpLCS TCSBray hasnt liked tweet yet idiot,4/8/2019 14:02
New publication Papworth author Short LongTerm Adverse Events Patients Temporary Circulatory Suppo ,4/8/2019 14:00
RT matthewjdowd DavidCornDC realDonaldTrump Same Bernie,4/8/2019 14:00
RT DavidCornDC Today would good day realDonaldTrump release tax returns,4/8/2019 14:00
Can stay undefeated tcsesports league Lets find Tonight h face lausanneesports ,4/8/2019 13:58
GCSE pupils Log details coming way soon We excited start using educakescience ,4/8/2019 13:58
OyeNooreiiiii kiahai enZilx HasnainSayss MeKonHoon Tcs krri hon UFDUFUF,4/8/2019 13:56
Join us th pm Downing street stand solidarity hunger strikes The situation worsens ,4/8/2019 13:54
Short sale vol short interest     ,4/8/2019 13:54
sobervinyls SOMEONE REALLY NEEDS TO TAKE A GOOD LOOK AT THE TALENT OF YOUR BROTHER Tcs could never,4/8/2019 13:53
A real estate company plans move former restaurant space near Camelback Road th Street Phoenix ,4/8/2019 13:48
anandmahindra TCS U something else sir,4/8/2019 13:47
RaoSumukh Nevermind Doesnt change fact I complete graduation I gotta work TCS like ,4/8/2019 13:46
RaoSumukh Hail TCS,4/8/2019 13:44
TCS largest logistics services infrastructure fulfill shipping needs TCS WeMoveYou ,4/8/2019 13:42
Tata Consultancy Services TCS also joined hands Ripple providing blockchain related services ,4/8/2019 13:40
DigitalTransformation Ideas ahead Time Ideated Govt Of India Implementing READ MORE Six pr ,4/8/2019 13:38
RT AndrewHIntl Great see strong Canadian presence baumaOfficial Bauma supported CanEmbGermany TCSSDC Best wishes,4/8/2019 13:37
Soon UFUF  ,4/8/2019 13:36
Tcs ce In single day Almost double future options positional ,4/8/2019 13:33
Off NYC TCS missions trip ,4/8/2019 13:31
Guess Indian IT major faced HB rejections ,4/8/2019 13:30
TCsday Tapos world yung mga design Out world din na testing gagawin dito hahahaha,4/8/2019 13:28
Global IT Giant TCS Adopts RippleNet TCS services CitiBank UK General Electric Microsoft name TCS ,4/8/2019 13:27
muse Done How,4/8/2019 13:18
Guess Indian IT major faced HB rejections ,4/8/2019 13:15
TCS bull pattern confirmed amp BUY signal issued  Buy Level,4/8/2019 13:13
TCS Healthcare Technologies Releases ACUITYnxt The newest SaaSbased case management software offers Asses ,4/8/2019 13:13
RT UN The cherry blossoms full bloom UNGeneva signaling arrival Spring Learn work done yea,4/8/2019 13:10
anandmahindra TCS Postpaid broadband bill I needed Folks queue Aadhaar took much time ,4/8/2019 13:09
RT gsthelpline The GSTR return form filed ecommerce companies month Ecommerce companies registered GST regi,4/8/2019 13:04
Three options address shortage nurses Focus grassroots levels motivate next generations pu ,4/8/2019 13:02
Listening love SOS ft TCS like DAB DAB FRUITY FRUITY LOOP LOOP,4/8/2019 13:01
RT ankksjethani hjtraffic narendramodi PMOIndia PrakashJavdekar Infosys TCS RJSangram ShefVaidya aparanjape CMOMaharashtra,4/8/2019 13:01
Ripple XRP Partner Indian IT Giant TCS Ties Major Bank Positive Effects XRP Expected ,4/8/2019 13:01
BananaManez tcsesports SILENTGAMINGCH CaraFlick I win UF,4/8/2019 13:01
CEOs playing increasingly important role maintaining brand company Heres matters ,4/8/2019 13:00
SantoshSWadekar anandmahindra TCS SushmaSwaraj RahulGandhi Im even putting opinion im putting ,4/8/2019 12:59
RT LMargenauTCS Its exciting time India worlds dynamic cities TradeTeamIndia TCSSDC ready,4/8/2019 12:56
Pain amp Diery The TCS Girl ,4/8/2019 12:55
Thriving communities TCs vital America I love participating building TCs military populations bec ,4/8/2019 12:53
TCS Get Parmo take home ya,4/8/2019 12:53
RT TCSCognitiveBiz A machinefirst automation approach allows company radically rethink key business processes achieve breakthr,4/8/2019 12:51
RT TCSNews Were pleased share NBBOnline selected TCSBaNCS CoreBanking part digitaltransformation drive,4/8/2019 12:51
How technology gamechanger marketing function Discover answer session ,4/8/2019 12:50
A machinefirst automation approach allows company radically rethink key business processes achieve break ,4/8/2019 12:43
anandmahindra TCS could get one without aadhaar also reasonably quick time way back,4/8/2019 12:43
CaratschRL tcsesports SILENTGAMINGCH Just win Head,4/8/2019 12:42
Powered TCS Official Virgin Money LondonMarathon Official Race App available download ,4/8/2019 12:41
repmcgovern please help give TCs dispatchers recognition deserve supporting Rep ,4/8/2019 12:41
senwarren please help give TCs dispatchers recognition deserve supporting Rep ,4/8/2019 12:41
SenMarkey please help give TCs dispatchers recognition deserve supporting Rep ,4/8/2019 12:41
DheerajDamera The sms service provided Ms TCS Passport Office connected servic ,4/8/2019 12:40
TCS payment solution leveraging RippleNet XRP ,4/8/2019 12:36
TCS offices across countries delivery centers countries And magic TCSBaNCS ,4/8/2019 12:35
Me AD Post used home delivery option What happened AD TCS dont give Intercity option Why ,4/8/2019 12:35
RT MrsBurczykMaths Year Easter revision intermediate tier Tuesday th April ampm mrsecm YGTredegarCS,4/8/2019 12:35
Guess Indian IT major faced HB rejections  via qzindia,4/8/2019 12:34
RT Balatweets cbm anandmahindra TCS I got passport renewed days normal category without Aadhaar Also Aadhaar address,4/8/2019 12:34
RT cbm anandmahindra TCS Mr Mahindra Feb monster called Aadhaar still makingI visited Bangalorekiosk ren,4/8/2019 12:34
TCS set scale new highs Just week Quarter Results believe stock scale bac ,4/8/2019 12:29
Ripple  Partner Indian IT Giant TCS Ties Major Bank Positive Effects XRP Expected ,4/8/2019 12:28
Tata Consultancy Services global banking platform called TCS BaNCS services quarter worlds pop ,4/8/2019 12:28
RT selvaraghavan Hi friends NGKSingleFromthApril Hope like NGK thisisysr Suriyaoffl prabhusr SaiPallavi R,4/8/2019 12:26
Bakers Aye I wasnt fan hahah,4/8/2019 12:24
rupasubramanya anandmahindra TCS associated project since ppp model due renewal ,4/8/2019 12:23
TCS Seriously Blooming delicious,4/8/2019 12:21
TCSUKI TCS AppStore Android please look us Brazil working iOS,4/8/2019 12:21
Bakers UF rank,4/8/2019 12:21
Ripple Indian Multinational IT Service TCSs Payment Solution Likely Runs RippleNet ,4/8/2019 12:19
TCS Arch Summit  arch,4/8/2019 12:18
awasthis abpnewstv abpnewshindi YagnikAmi RakeshSinha Yagnik Ji ko mai ek padhi likhi mahila manta hu ,4/8/2019 12:17
entrackr jaivardhan ZomatoIN swiggyin UberIndia TCS unnecessary complication Especially businesses ,4/8/2019 12:16
Up The Story My Name Personalised Book The Ideal Customised Gift £ TampampCS Must redeem ,4/8/2019 12:14
TCS Go get lemon top ,4/8/2019 12:13
Join TCS BioIT explore dynamics pharma biotech RampD driven technology forces like AI ,4/8/2019 12:11
TCS Arch Summit  arch,4/8/2019 12:11
anandmahindra TCS New India,4/8/2019 12:10
TCS Shut trampy little mouth,4/8/2019 12:08
Join us webinar know Jile help large scale agile transformation deliver value cu ,4/8/2019 12:07
TCS looks good charts,4/8/2019 12:07
RT kdmarketinsight Get Recent Research Report kdmarketinsights BusinessProcessManagement Market BPM globally ,4/8/2019 12:03
sahneydeepak Tcs go tmrw even result announced th  view ,4/8/2019 12:01
Boro shithole freezing Monday feeling Am probably guna Chinese ,4/8/2019 11:57
ACHIEVEMENT Pakistan Post extended service countries A threat TCS DHL amp Gerrys PakistanPost ,4/8/2019 11:56
icpe research cafe TCS open ,4/8/2019 11:54
An evening walk DSt Investors book profits higher levels IT gains rupee weakens In terms sectors ,4/8/2019 11:50
Infosys TCS Indian ITs top HB visa rejects ,4/8/2019 11:43
Indian IT faced HB rejections    ,4/8/2019 11:42
I like streaks like one TCSNews ,4/8/2019 11:40
IBM Qradar SIEM training Starting New batches th April For Registration infocryptofyin ,4/8/2019 11:37
Over many years hamburgers become favourite throughout world Many food outlets South Africa compete ,4/8/2019 11:36
Two absolutely gorgeous looking CA Instinct Harrow Size Cricket Bats Nice light weights lb oz stunning grai ,4/8/2019 11:35
troyhstrojans CoachMetz Congrats Jesse family Hard work pays Way go,4/8/2019 11:33
hjtraffic narendramodi PMOIndia PrakashJavdekar Infosys TCS RJSangram ShefVaidya aparanjape Please solve ,4/8/2019 11:33
msmbana uttamkaul ANI worry country entire countrys stock exchange value less sing ,4/8/2019 11:32
Hope greater hurt Stay course tcsPACE Hope ,4/8/2019 11:30
The GSTR return form filed ecommerce companies month Ecommerce companies registered G ,4/8/2019 11:30
Other top losers Bajaj Finance Vedanta Tata Motors Reliance Industries SBI  dropping much p ,4/8/2019 11:25
Join us PegaRoadshow Amsterdam th April discover Machine First approach leverages RPA ,4/8/2019 11:25
Companies like WIPRO TCS TVS Reliance may given responsibility money,4/8/2019 11:24
RT LaReinaJulie Great group cadets representing UTCSMCJROTCU UTransylvaniaSchU URosmanHSU rosman iwojima ,4/8/2019 11:23
RedBeanFGC Overly aggressive players guess correctly aggression TCsTJs stepping really ,4/8/2019 11:23
Pakistan Post extended service countries A threat TCS DHL amp Gerrys PakistanPost Courier ,4/8/2019 11:21
Sorry TCS At ,4/8/2019 11:21
Lord I Believe Milton Brunson TCS Darius Brooks  via YouTube,4/8/2019 11:16
AWARD FINALIST SPOTLIGHT Digitate TCS Finalist Technology Enabled Process Automation Category ,4/8/2019 11:15
AWARD FINALIST SPOTLIGHT Digitate TCS Finalist Technology Enabled Process Automation Category ,4/8/2019 11:15
LondonMarathon TCSUKI please look us Brazil working iOS,4/8/2019 11:15
AWARD FINALIST SPOTLIGHT Digitate TCS Finalist Technology Enabled Process Automation Category ,4/8/2019 11:15
RaoSumukh Is PESU I graduated PESIT us saal TCS ko nahi bulaya tha unhone P,4/8/2019 11:15
Basically colleges polite way saying doesnt matter branch study placement toh TCS hi hoga ,4/8/2019 11:12
TCS stands business superbrand fifth year row  ITSector StockMarket ,4/8/2019 11:11
Ive many creative things lately makes sad I cant fulltime someday I suppose,4/8/2019 11:10
Piggs would say lego star wars TCS already perfect,4/8/2019 10:56
ravihanda Shayad TCS ko outsource kiya hua hai Im correct,4/8/2019 10:54
Welcome markrusselluk TCS London Hub looking forward meeting telling amazing ,4/8/2019 10:53
Listen TCS Psicanalizame prod Sobras Andamento Records np SoundCloud ,4/8/2019 10:52
ECISVEEP myogiadityanath SpokespersonECI attaching document wait vote Is ,4/8/2019 10:49
pbhakat vikki anandmahindra TCS LocalCircles MEAQuery passportsevamea newproblem FearRTs SpeakUpIN ,4/8/2019 10:47
ServetteEsports We ready excited ,4/8/2019 10:46
Come meet representatives pathology management team Staff Wellbeing We would love get v ,4/8/2019 10:45
Guess Indian IT major faced HB rejections ,4/8/2019 10:45
TCS named business superbrand fifth consecutive year Know more ,4/8/2019 10:44
broddersbe StopwatchRacing If TCs words needs fully public limelight,4/8/2019 10:44
PsynoxRL SyntaxCH tolojule SILENTGAMINGCH We looking forward seeing play ,4/8/2019 10:43
Web based diagnosticmanagementsystem  ,4/8/2019 10:42
anandmahindra TCS Sir I think missed tag SushmaSwaraj ji UF,4/8/2019 10:41
RT TCSANZ You live track favourite AustralianRunningFestival runners official Australian Running Festival app,4/8/2019 10:38
Infrastructure Asia meets Canadian Infrastructure roundtable High Commission discuss opportunities fo ,4/8/2019 10:37
Guess Indian IT major faced HB rejections ,4/8/2019 10:35
Used gallus tcs sale ,4/8/2019 10:34
Hiring Urgent Requirement TCS Java Production Support Kochi Kochi Exp years ,4/8/2019 10:32
Hiring Urgent Requirement TCS Angular JSProduction Support Kochi Kochi Exp years ,4/8/2019 10:32
Varieties property projects SuperCorridor indore Lets explore  Luxu ,4/8/2019 10:31
NIFTY TOP GAINERS amp TOP LOSERS TOP GAINERS TECHM INFY MampM TCS POWERGRID TOP LOSERS IBULHSGFIN IOC ,4/8/2019 10:22
Major Company Result Calender TCS INFY TATA METALIK Tinplat Wipro cont ,4/8/2019 10:22
anandmahindra TCS Im aam aadminot associated aap I applied normal passport Dec Police verificatio ,4/8/2019 10:19
TCS Named Business Superbrand Fifth Consecutive Year ,4/8/2019 10:18
SyedAbdulMujeer Abhishekkar wanna coffoe tcs UF,4/8/2019 10:12
Tcs amp tech mahindra looking good,4/8/2019 10:11
Guess Indian IT major faced HB rejections ,4/8/2019 10:10
SyedAbdulMujeer Abhishekkar friday resultshai TCS ke,4/8/2019 10:07
shivaji view tcs,4/8/2019 10:07
If data research inducedseismicity manmade earthquakes interests dont miss ,4/8/2019 10:06
We would love bring Creative Crafters adult classes Harrogate Knaresborough gets lots reques ,4/8/2019 10:05
Next days I available due electon duty becas I give fresh trade Vedanta opton loss cash carr ,4/8/2019 10:05
Just regret missed trade The scrips strong tdy TCS lupin may fall tmrw N weaker ,4/8/2019 10:04
dpsatish anandmahindra TCS Agree Thank God somethings dont change irrespective changes,4/8/2019 10:02
EGU At stand see EPOSeu demo session presentations On Monday Marc Schamings talk ,4/8/2019 10:00
TCS Named Business Superbrand Fifth Consecutive Year ,4/8/2019 10:00
RESULTTRADE TCS CE Buy Near Target STOP LOSS,4/8/2019 9:59
RT qz Guess Indian IT major faced HB rejections ,4/8/2019 9:57
RT ukpolygon On dark damp days like today reminded various ways use Temporary Climate Control solutions TCS control,4/8/2019 9:57
RESULTS CALENDAR NIFTY STOCKS TCS INFOSYS TH APRIL WIPROTH APRIL HDFC BANK TH APRIL ULTRATECH CEM ,4/8/2019 9:56
NIFTY low getting support TCS INFY Rs laugh retail traders ,4/8/2019 9:54
Consequently RippleNet implemented tap global population via TCS BaNCS ,4/8/2019 9:54
TCS Book Fair school library From today Wednesday Latest Titles Prices   DEAR ,4/8/2019 9:54
milestone year TCS UK globally That proud recognised Business S ,4/8/2019 9:52
RESULTS CALENDAR NIFTY STOCKS TCS INFOSYS TH APRIL WIPROTH APRIL HDFC BANK TH APRIL ULTRATECH CEM ,4/8/2019 9:52
NoxKeve PinchAColada tcsesports today today today today today today today today glhf,4/8/2019 9:51
tcscouriers You told us day shipment took day kindly tell exact time ur customers ,4/8/2019 9:49
RRBKOLKATA TCS DRMbhopal PiyushGoyal PiyushGoyalOffc RailMinIndia ln alp cbt different beetween master ,4/8/2019 9:48
Ripple Indian Multinational IT Service TCSs Payment Solution Likely Runs RippleNet ,4/8/2019 9:47
eltanh EsraAygin WorldBank EUCommission ppl Id b curious equivalent Q wd u agree principle ,4/8/2019 9:46
Guess Indian IT major faced HB rejections ,4/8/2019 9:46
LOOK AT TCS amp INFY AT DAY HIGH BOTH potstocks cannabis StocksToWatch marijuanastocks ,4/8/2019 9:45
Guess Indian IT major faced HB rejections ,4/8/2019 9:45
LOOK AT TCS amp INFY AT DAY HIGH BOTH theusaeconomy econtwitter economics StockMarketNews ,4/8/2019 9:44
LOOK AT TCS amp INFY BOTH AT DAY HIGH nifty nifty banknifty NSE Stocks NSE BSE Positionaltrade NSE ,4/8/2019 9:43
LOOK AT TCS amp INFY AT DAY HIGH BOTH PLDailyPoll MarketPoll StockMarket Nifty NSE PLIndiaOnline ,4/8/2019 9:42
LOOK AT TCS amp INFY AT DAY HIGH BOTH investments sensex financialadvisor sip investing ,4/8/2019 9:42
anandmahindra TCS I similar experience last year I went Passport seva Kendra near ITO Delhi ,4/8/2019 9:41
RailMinIndia PiyushGoyalOffc PiyushGoyal Sir Paid fee recheck wrong answer key wrt CEN But ,4/8/2019 9:41
MoneyMystery Bro Is TCS taking care Nifty Reliance falling,4/8/2019 9:40
RT equitybulls TCS Named Business Superbrand Fifth Consecutive Year ,4/8/2019 9:40
TCS BaNCS Indian MNCs Financial Solution Connect RippleNet CrossBorder Payment Processing ,4/8/2019 9:39
Congratulations RuddDarren Head Public Affairs TCSANZ appointment Australia ,4/8/2019 9:38
anandmahindra TCS Mr Mahindra one blessed privileged ones People chasing following ,4/8/2019 9:37
Strong rally expected IT IndexBig IT TCS INFY result next week investments sensex ,4/8/2019 9:36
Canada ASEAN concluded second set FTA exploratory discussions looking forward continuing dee ,4/8/2019 9:36
Strong rally expected IT IndexBig IT TCS INFY result next week PLDailyPoll MarketPoll ,4/8/2019 9:36
Quartz leverages blockchain technology cross border remittance solution TCS BaNCS universal finan ,4/8/2019 9:36
Why MampA driven companys desire DigitalTransformation Learn Dave Jordan Vice Presiden ,4/8/2019 9:36
Strong rally expected IT IndexBig IT TCS INFY result next week nifty nifty banknifty NSE ,4/8/2019 9:35
Strong rally expected IT IndexBig IT TCS INFY result next week theusaeconomy econtwitter ,4/8/2019 9:35
Strong rally expected IT IndexBig IT TCS INFY result next week potstocks cannabis StocksToWatch ,4/8/2019 9:34
RajarshitaS sanstocktrader bluechipsu BissaGauravB trivedisid RishikeshADX entrepreneur index onve ,4/8/2019 9:34
sos stans everytime find new reason hate tcs ,4/8/2019 9:33
crypticfebin TCS To confirm already emailed Indian team,4/8/2019 9:33
TCS Quartz Cross Border Remittances solution allow connecting RippleNet  ,4/8/2019 9:32
TCS,4/8/2019 9:32
TCS Arch Summit  arch,4/8/2019 9:24
The CanEmbGermany Showcase BrilliantMat organic electronics BiomeRenewables wind turbine BluWaveai smart ,4/8/2019 9:23
TCS Target hit UFAF That day UF ,4/8/2019 9:22
DeadmanInc SnowFlakeLeftie denniallen Bukumbooee When TCs pupils looks like bowling balls Im Ian,4/8/2019 9:19
Great see many Canadian ASEAN experts Lao PDRUFFUFE second exploratory discussions possible ,4/8/2019 9:15
AvjitOfficial rajnishMidas dhruvrathee Avjit ji common misunderstanding india Largest private ,4/8/2019 9:12
T Sir I request please check find amount reflecting account While TCS ha ,4/8/2019 9:12
IoT TCS Business   see ,4/8/2019 9:10
IoT Peeps check TCS Business   see ,4/8/2019 9:10
RT TCSDigitalTech Do want turn IoT technologies profitable strategic initiative org Heres begin,4/8/2019 9:06
RT TCSDigital The challenge DigitalTransformation covers much ground organizations dont know start,4/8/2019 9:06
RaghavendraUp asifd anandmahindra TCS MMS ko ye Sonia gang kaam hee nahi karne diya ye maa beta betee dam ,4/8/2019 9:04
RT magento The ImagineExcellenceAwards finalists BEST BB INNOVATIONS GoDirect Trade Honeywell Tata Consultancy Service,4/8/2019 9:04
TCS BaNCS welcomes WFC delegates  ,4/8/2019 9:02
TCS This Whole Experiment Green  ,4/8/2019 9:00
