Text,date
RT TheCoachesSite In U fourth final instalment Jon Goyens Pro Skills Drills video series Shooting Progressions Jon takes,4/6/2019 17:11
RT NewquayZoo Weve got ASAP exciting news To begin countdown th Anniversary launching special compet,4/6/2019 17:11
The outcome PRIOR CHESTNUTS FUNDRAISER March UFUFFU U The PriorChestnuts dragonboat team breast ,4/6/2019 17:11
anandmahindra TCS New india old india UFEEUFF,4/6/2019 17:10
TCS Developing Five Blockchain Platforms ,4/6/2019 17:09
anandmahindra AvinashGoraksha TCS Sir TCS ruined Department Post SAP Ask employee Dept Po ,4/6/2019 17:09
Why Flipkart Amazon OYO Paytm TCS Reliance Indians want work ,4/6/2019 17:08
Why Flipkart Amazon OYO Paytm never TCS Reliance place Indians need work  ,4/6/2019 17:08
anandmahindra TCS Sir great give credit due even competitor,4/6/2019 17:06
Sab tcs kar rhi hi ASAP official demand,4/6/2019 17:06
SahukarShivaraj asifd anandmahindra TCS AskAnshul No Its Motilal Nehru Who Gave Adhar UFUFUF,4/6/2019 17:05
anandmahindra MainChowkidar TCS Superb services,4/6/2019 17:05
Issk anandmahindra TCS You need visit personally renew passport indiaUF rupasubramanya something fishy,4/6/2019 17:05
anandmahindra TCS TCS best,4/6/2019 17:04
Issk anandmahindra TCS Looks like u stepped century The new passport sewa kendras operation last years,4/6/2019 17:03
TomWinter This,4/6/2019 17:02
iamraineyy Lush,4/6/2019 17:02
vikki anandmahindra TCS I shocked Submitted application fr Reissue passport Jhargram POPSK ,4/6/2019 17:02
RT akmathew anandmahindra TCS Have experienced efficient process TCS runs since We passport office yesterday,4/6/2019 17:02
TCS Al give ya next next away day,4/6/2019 17:02
RT FruityCoops Chroniques est en live  ,4/6/2019 17:01
anandmahindra yashranjeet TCS True experience last time went passport office,4/6/2019 17:01
Weve got exciting news To begin countdown th Anniversary launching specia ,4/6/2019 17:01
Plug Canadas thriving global ecosystem grow business wUPSSmallBizCA TCSSDC ,4/6/2019 17:00
Join masses run one iconic races TCS NYC Marathon Cross finish line othe ,4/6/2019 17:00
Spring officially sprung means running season upon us The best part Team Bright Pink open spots ,4/6/2019 17:00
anandmahindra TCS SushmaSwaraj maam appreciation one great personalities one I admire lo ,4/6/2019 17:00
Issk anandmahindra TCS Please attribute political colours MrAnand Mahindra Typically focuses positive happenings,4/6/2019 16:59
Issk anandmahindra TCS No doubt passport seva Kendra RTO services become professional par ,4/6/2019 16:59
anandmahindra TCS But u r travelling foreign trip,4/6/2019 16:59
anandmahindra TCS Not true I hard time Gurugram psk Very unprofessional contract staff commitment service,4/6/2019 16:58
RT CanadainIndia We thrilled announce new podcast series The CanadainIndia Show UFCheck teaserUF Stay tuned,4/6/2019 16:58
anandmahindra TCS Happy New year,4/6/2019 16:58
anandmahindra TCS SushmaSwaraj Ji We became fans work amp ministry,4/6/2019 16:58
anandmahindra TCS Applied passport reissue March amp documents submitted March Passport stil ,4/6/2019 16:57
pbeema anandmahindra TCS Yeah cuz congress thats,4/6/2019 16:56
anandmahindra TCS Do need words appreciation people like u sir Does make lot difference ,4/6/2019 16:55
asifd anandmahindra TCS No credit Aadhar card always goes Nehru revived Congress partition,4/6/2019 16:55
RT ChasButtigieg Remember lessons learned school still apply today Do unto others Use I statements put kindness behi,4/6/2019 16:55
RT KamalaHarris As president I would double size Civil Rights division Justice Department government must,4/6/2019 16:54
anandmahindra TCS This perfect example process gets improved follow proper professional approach help experts,4/6/2019 16:54
vijayanands Incidentally TCS also runs train reservation system Infosys however runs GST network I stop,4/6/2019 16:53
BreakingNews Amit Shah holds top stocks like RIL TCS UltraTech Affidavit EC UADSSWelfareWorksAprilWeek ,4/6/2019 16:53
iamraineyy Aye piss rainey,4/6/2019 16:53
TCS Al eat words,4/6/2019 16:52
avixanu asifd anandmahindra TCS AskAnshul Nehru ka baap ka naam Bhi siddiqqi Nehru kaise bana ye Bhi ,4/6/2019 16:52
anandmahindra ChowkidarMohit TCS My passport renewal hardly take minutes PSK The team super effici ,4/6/2019 16:51
anandmahindra TCS Sir always humble earth Love reading tweets holding companies stockUFA,4/6/2019 16:50
anandmahindra TCS Sir seem gotten VIP treatment I got passport booklet done India ,4/6/2019 16:49
Paultmf TCSadammarathon TCS citizenM Schiphol KLM racecheck UKRunChat adidasUK Thanks wearing shorts ,4/6/2019 16:48
anandmahindra TCS It indeed issir Proud infrastructure services,4/6/2019 16:48
anandmahindra TCS O oh Aadhaar needed thats lost plot Sir,4/6/2019 16:48
meecee TCSadammarathon TCS citizenM Schiphol KLM racecheck UKRunChat adidasUK It warm I ru ,4/6/2019 16:46
anandmahindra TCS Had pleasant experience Gurgaon tooSuper efficient Passport Seva Kendra,4/6/2019 16:46
anandmahindra TCS My experience I submitted application Reissue passport Jhargram POPSK ,4/6/2019 16:46
Kudos TCS ,4/6/2019 16:45
We hardly wait see kalebrashad third annual Inquiry Project Collaborative TCS June Blockch ,4/6/2019 16:45
anandmahindra TCS Absolutelythese guys efficient process drivenhad renewed passport within ,4/6/2019 16:44
robbo Unreal mate absolutely unreal After cross country Cheltenham obvious,4/6/2019 16:43
anandmahindra TCS Chal Jhoota Thats Pappus morons read Omar Barkha say,4/6/2019 16:41
anandmahindra TCS narendramodi SushmaSwaraj You right sir amp also agree Ideas amp Technology w ,4/6/2019 16:41
It supposedly police verification moment Lets hope goes well Passport service perhaps one ,4/6/2019 16:40
Paultmf TCSadammarathon TCS citizenM Schiphol KLM racecheck UKRunChat adidasUK Looking forward one ,4/6/2019 16:40
TCS TCS Probable Volatile movement coming Months TradingView ,4/6/2019 16:40
ClaireWynarczyk TCSadammarathon TCS citizenM Schiphol KLM racecheck UKRunChat adidasUK Thanks got quite ,4/6/2019 16:39
Amit Shah holds top stocks like RIL TCS UltraTech Affidavit EC ,4/6/2019 16:37
TCS I backed much What horse man,4/6/2019 16:37
anandmahindra TCS Earlier I thought big person ever go place like common ordinary ,4/6/2019 16:34
RT StoupasTeresa It pleasure see develop musically academically elementary middle school years She,4/6/2019 16:33
anandmahindra TCS Indeed real transformation passport services last years My daughter told pa ,4/6/2019 16:33
RT narayanashenoy indianuncle anandmahindra TCS And credit goes one MMS brought scratch,4/6/2019 16:33
anandmahindra TCS cmohry couldnt say thing Visited municipality updation birth ,4/6/2019 16:32
writesohail VishnuNDTV IAFMCC Dont want humiliate u may I know whats amount allocated Pak budge ,4/6/2019 16:32
anandmahindra TCS You getting VIP Treatment Mahindra Aam Aadmi,4/6/2019 16:31
Tiger roll fucking boy Love Davy Russell love Gordon Elliott Fucking get upppppp,4/6/2019 16:31
anandmahindra TCS amp yes Parel passport office,4/6/2019 16:31
dpsatish anandmahindra TCS Level pace modernization UPA even worth mention tho ,4/6/2019 16:30
RT PeteButtigieg Hey ChasButtigieg I think I found us new hangout Manchester ,4/6/2019 16:30
Fintech financial future Are fintech entrepreneur looking scale Need support tools go gl ,4/6/2019 16:30
anandmahindra TCS Absolutely right sir Its takes min Many thanks narendramodi amp SushmaSwaraj,4/6/2019 16:29
anandmahindra TCS Completely agree Still another bottle neck police verification creating hurdles ,4/6/2019 16:29
anandmahindra TCS I similar amazing experience months backin less minsnew pa ,4/6/2019 16:29
Absolutely I PSK Panajji one Finest example smooth governance Credits TCS ,4/6/2019 16:29
getmetwister anandmahindra TCS It despatched day amp received home next day I tweeted ,4/6/2019 16:29
TCS Get son,4/6/2019 16:28
Issk anandmahindra TCS To fair PSKpassportsevakendra simplesteasiest process implement ,4/6/2019 16:28
TCS HES THERE LAD,4/6/2019 16:28
anandmahindra TCS Agree anandmahindra Sir Even I pleasant experience Got passport delivered home hours,4/6/2019 16:28
anandmahindra dhaval TCS INDEED UFD Thats AMAZING Change amp Fresh Feeling Thank much Team ,4/6/2019 16:27
anandmahindra TCS Great Something proud,4/6/2019 16:27
hadnt drawn lgpe mina time plus needed rep onedraw prefer GLs TCs bepis,4/6/2019 16:27
anandmahindra TCS Spot try election commission aswell Mighty impressive,4/6/2019 16:26
anandmahindra TCS UFF Hope Infosys also away GSTN Make World class No glitches Just So Quickest,4/6/2019 16:24
anandmahindra TCS Only BJP,4/6/2019 16:24
anandmahindra TCS Getting Aadhar card became biggest lroble,4/6/2019 16:23
anandmahindra TCS Hope start Passport wapasi people protest taken Aadhar ,4/6/2019 16:22
anandmahindra TCS But I think quite time,4/6/2019 16:22
anandmahindra TCS AcharyaPramodk RahulGandhi priyankac priyankagandhi Did read This NEW IN ,4/6/2019 16:21
anandmahindra VORdotcom TCS And TCS govt entity,4/6/2019 16:21
anandmahindra TCS Superb serice everywhere IndiaThanks SushmaSwaraj ji UFF,4/6/2019 16:20
anandmahindra TCS Its previous congress govt implemented passport seva kendra,4/6/2019 16:20
DuncleManfredi Respect lets hang soon UUFEF,4/6/2019 16:20
anandmahindra TCS Apply online Upload documents pay fees online No Dalals like ShekharGupta needed ,4/6/2019 16:20
Issk anandmahindra TCS The process established smooth early I personal experience ,4/6/2019 16:20
meecee TCSadammarathon TCS citizenM Schiphol KLM racecheck UKRunChat adidasUK Oh wow good luck,4/6/2019 16:19
anandmahindra TCS Things definitely improved great deal However guys supposed manning differen ,4/6/2019 16:19
anandmahindra TCS Indeed process seamless hasslefree getting passport done earlier used real nightmare,4/6/2019 16:19
Hey Satish agree started TCS UPA era however I visited regime however experience ,4/6/2019 16:19
This amazing Well done team tcsna TCS ,4/6/2019 16:19
anandmahindra TCS So nice candidly praise tcs High dharma,4/6/2019 16:18
RT meecee Thats TCSadammarathon TCS booked upcitizenM hotel Schiphol KLM flights booked UUU Anyone want join raceche,4/6/2019 16:17
meecee TCSadammarathon TCS citizenM Schiphol KLM racecheck UKRunChat adidasUK Best marathon ,4/6/2019 16:17
Woah last minute goal Badmonk vs SwissIncRebels UF This love Rocket League ,4/6/2019 16:16
anandmahindra The days harassment gone The TCS team infact helps In case minor issues p ,4/6/2019 16:16
anandmahindra TCS Agree sir Passport office experience much smooth,4/6/2019 16:15
anandmahindra TCS Tell TCS guy increase salaries sir,4/6/2019 16:15
True stockbroking roots entering active politics Amit Shah owns shares several large midcap ,4/6/2019 16:15
ifateh CSI started TCS started Patni started HCL started PCS started ,4/6/2019 16:14
anandmahindra FullmoonNayak TCS I got reissue days Amazing work SushmaSwaraj passportsevamea ,4/6/2019 16:14
Naveah Richardson Tiny Miss Southview todayUF SouthviewTCS TCSBoardofEd ,4/6/2019 16:13
dpsatish anandmahindra TCS The suggestion call implemented narendramodi govt,4/6/2019 16:13
Idrissheikh Dude No You naughty UFUFUF,4/6/2019 16:13
anandmahindra TCS I agree fullyI went yesterday passport seva Kendra kamala mills get ,4/6/2019 16:11
anandmahindra TCS I visited Herald House Delhi awestruck see systems So dig ,4/6/2019 16:11
Please tiger roll Please,4/6/2019 16:10
anandmahindra TCS Many congratulations putting truth clear terms,4/6/2019 16:10
anandmahindra TCS They look cute smart even AM,4/6/2019 16:07
anandmahindra TCS Sir people like always smoothbut time election cash donations ,4/6/2019 16:07
Ironhorse Smilan Just remember best pitch spending enternity religious big ,4/6/2019 16:07
SoftwareDevelopment UF Top Largest Companies Software amp Programming Sales  UFFAUFFAlphabet ,4/6/2019 16:06
Watch Nifty BankNifty Tata Steel JSW Hero Moto RCom IT FMCG DHFL TCSIdea Weekly Stock Market ,4/6/2019 16:06
RT sahluwal This racist white woman Dallas Texas threatened call ICE taco truck operating permit Twitter,4/6/2019 16:05
Thats TCSadammarathon TCS booked upcitizenM hotel Schiphol KLM flights booked UUU Anyone want join ,4/6/2019 16:05
AnnAnnChe While Julian incredibly impressive couch compliment attack another candidate ,4/6/2019 16:04
anandmahindra TCS Good work always gets recognized tcs Kudos anandmahindra took time appreciate go ,4/6/2019 16:03
Verner Robotics teams ready UA competition Thanks support TCS uarc VESsoars tcslearns ,4/6/2019 16:03
anandmahindra TCS All credit SushmaSwaraj team get things simplified Proud extcsemployee,4/6/2019 16:02
anandmahindra TCS Only rich people inUF,4/6/2019 16:02
anandmahindra TCS Just u sirfir commoner still struggle,4/6/2019 16:02
ReaganGomez Not midpoint series She really first character show became teen ,4/6/2019 16:01
anandmahindra TCS True True True My first passport handwritten took embarrassingly long time The sec ,4/6/2019 16:01
RT kylegriffin A small army whistleblowers across Trump admin working secret House Oversight Committee,4/6/2019 16:00
Sir u say tcs congress say modi ji ne crore aapne dost ratan tata ki pocket mein daldiya ,4/6/2019 16:00
RT MaheshBhatt anandmahindra TCS You celebrity hence treatment photo These tcs guys behave differently,4/6/2019 16:00
anandmahindra TCS I hope govt services like,4/6/2019 16:00
anandmahindra TCS Thanks Mr Mahindra lauding unnoticed efforts NaMo Govt There PSKs ,4/6/2019 16:00
dpsatish anandmahindra TCS Will Mr Mahindra clarify complimented UPA govt Modi govts As moderni ,4/6/2019 15:59
Thats like respect man Even though IT company MTech still hes praising rival co ,4/6/2019 15:59
anandmahindra TCS Thank u A O Hume,4/6/2019 15:58
simplyshekhar anandmahindra TCS None like Check local police station Application ,4/6/2019 15:57
anandmahindra TCS Thanks subhash chandra bose visiting germany japan,4/6/2019 15:57
anandmahindra TCS And say nothing improved Modi Govt taken charge,4/6/2019 15:56
MissSOS Kills slowly As people saying TCS UFUF,4/6/2019 15:56
FHumungous anandmahindra TCS Ya sure,4/6/2019 15:56
anandmahindra TCS Yes wonderful experience Quick precise efficient,4/6/2019 15:56
gangwalsamyak anandmahindra TCS It easy masses Dont pappu try applying one appreciate midi ,4/6/2019 15:55
anandmahindra TCS BSNLCorporate please learn something We getting passport couple days ,4/6/2019 15:55
harmut anandmahindra TCS Well Passport Service really good Probably better VFS We get passpo ,4/6/2019 15:55
Thank anandmahindra kind words Its honour work alongside MEAIndia rajeshdogra ,4/6/2019 15:54
anandmahindra TCS Anand ji Please visit forest amp Revenue dept amp let Indians know whats going ,4/6/2019 15:53
Issk anandmahindra TCS Why Sanghi This service started UPA even Adhaar check ur facts,4/6/2019 15:53
anandmahindra TCS Agree I went renew kids Blore center process smooth f ,4/6/2019 15:53
TCS FLOORING CALL US FloorStore FreeEstimates springsales cityofyukonokgov amp okc ok ,4/6/2019 15:52
anandmahindra TCS Sir Dont mistaken Its time UPA,4/6/2019 15:49
TCS FLOORING CALL US FloorStore FreeEstimates springsales cityofyukonokgov amp okc ok ,4/6/2019 15:49
anandmahindra TCS I applied normal passport Friday Police verification done day Passport hands ,4/6/2019 15:49
RT KamalaHarris I didnt share single chip ,4/6/2019 15:48
RT ChasButtigieg Today Buttigieg I wish donate blood must abstain sex one year blood deemed unfit fo,4/6/2019 15:48
blueday anandmahindra TCS software designer taxation passport separate special qualifi ,4/6/2019 15:47
anandmahindra TCS TCS one best software provider,4/6/2019 15:45
anandmahindra TCS Yes easily get mseva app well NewIndia,4/6/2019 15:45
SahukarShivaraj avixanu asifd anandmahindra TCS AskAnshul Thank nehru comment likes UFUF,4/6/2019 15:44
RT PeteButtigieg You refer human beings animals You dont,4/6/2019 15:42
ScrptCS ExaammpLCS TeeeTv pxics itssBs JMitcsgo TCSBray flashyycsgo Iwtf,4/6/2019 15:42
rmmnagpur anandmahindra TCS What comparison taxation Software compared passport software UFUFUF,4/6/2019 15:41
We SVE Robotics Team UofAlabama SouthviewTCS KwsmithSVE irbyaka DocJay ,4/6/2019 15:40
anandmahindra TCS PSK doubt phenomenal But Aadhaar security threat Eg You update mobile ,4/6/2019 15:40
Issk anandmahindra TCS Senthil If u say like arent u talking like Pakistan PM Imran Khan RSS every ,4/6/2019 15:39
anandmahindra TCS Sir new Bharat,4/6/2019 15:38
LorenFoster HighMuseumofArt amymcintyretcs TCSmoms Whoa Here TCS kids I totally missed ,4/6/2019 15:36
Issk anandmahindra TCS Actually TCS govt started collaborating SMKrishnaCong foreign minister thats UPA,4/6/2019 15:34
RT AwadheshDammani Issk anandmahindra TCS Infact appreciate owns TechM make sure congratulate TCS like,4/6/2019 15:34
anandmahindra TCS Indeed TCS revolutionized Passport obtaining process course staff MEA ,4/6/2019 15:34
Girl Scout Troop presents check Paul W Bryant High School librarian Shelley Dorrill  ,4/6/2019 15:34
Mayank Jasore took full advantage pleasant weather went hammer tongs scored ball century set ,4/6/2019 15:33
Issk anandmahindra TCS Haha someone critisize Modi praises Modi becomes SanghiBhaqt aut ,4/6/2019 15:33
RT Saurabhmiku narendramodi pm sir please justice one listening regarding rrb alp cbt exam My marks,4/6/2019 15:32
asifd anandmahindra TCS Thankyou Indra ji UF,4/6/2019 15:32
anandmahindra TCS My wife went passport office Bangalore th Match renew passport It reache ,4/6/2019 15:30
RT andzalak anandmahindra TCS Thats lovely sir I got special treatment The Mumbai Police stalled verification reissuance ap,4/6/2019 15:30
This get true business tycoon like anandmahindra Sir True inspiration praising even ,4/6/2019 15:29
Issk anandmahindra TCS Appreciate case reissue passport goes printing day Earlier ,4/6/2019 15:28
jcostatcs Just post I feel like I engage comment,4/6/2019 15:28
anandmahindra TCS Yes sir new digital Indiathanks encouraging focussing efforts govt ,4/6/2019 15:28
anandmahindra TCS Thats say Hindustan Badal Raha HaiUFUFUFF,4/6/2019 15:28
anandmahindra TCS Main hurdle police verification,4/6/2019 15:27
anandmahindra TCS India stepping fast latest tech amp due efficiency seen every whereu r r ,4/6/2019 15:27
anandmahindra TCS Why u wear suits summers,4/6/2019 15:26
seriousfunnyguy anandmahindra Kapilagr TCS Aah didnt know could make requests without angering ,4/6/2019 15:25
anandmahindra TCS Saturdays PSK works I thought MonFri,4/6/2019 15:25
anandmahindra TCS You celebrity hence treatment photo These tcs guys behave differen ,4/6/2019 15:25
Time DeepSix Omnichannel Focus Experience new blog TCS Multichannel Merchant ,4/6/2019 15:24
RT foxdc IT TAKES SECONDS TO SHARE DC police say yearold Christian Isaiah Murray reported critically missing D,4/6/2019 15:24
RT tweissenburger HQ Train Trainer session TCSRefreshSDC TCSSDC new values kicked ,4/6/2019 15:23
anandmahindra TCS Agreed In took hrs centre lot agents asking tips get ,4/6/2019 15:23
Had great week learning thriving Life Sciences sector UFEUFE meeting amazing TCSSDC colleagues ,4/6/2019 15:21
anandmahindra TCS Waiting wifes passport last three months RPO Ghaziabad still got ,4/6/2019 15:20
anandmahindra TCS This done UPA Dr MMS,4/6/2019 15:20
I hate browsing social media accidentally hit like button feel like idiot lmao,4/6/2019 15:18
RT investcanada FactFriday Toronto regions FinTech ecosystem composed fintechs VC firms incubatorsaccel,4/6/2019 15:17
anandmahindra TCS Its Modi Sarkar excellent policies,4/6/2019 15:16
anandmahindra arunbtgbd TCS Lucky people got meet,4/6/2019 15:15
anandmahindra TCS Looks like got specialised VVIP treatment going officials lining pic UF,4/6/2019 15:15
narendramodi pm sir please justice one listening regarding rrb alp cbt exam My mark ,4/6/2019 15:14
Issk anandmahindra TCS So agree development efficiency makes sanghi,4/6/2019 15:14
Ignored TCs I got going,4/6/2019 15:13
Moms Music flashbackTCS ,4/6/2019 15:13
anandmahindra TCS Heard many peoplepassport making never smooth Great work everyone involved,4/6/2019 15:13
RT seriousfunnyguy anandmahindra Kapilagr TCS Im yet come across officer anywhere world refuse except US,4/6/2019 15:12
anandmahindra TCS It true sir I applied reissue passport They asked lots documents Pan ca ,4/6/2019 15:12
anandmahindra TCS Not uaethis wave seem hot shores uae still outdated mechanisms place,4/6/2019 15:11
anandmahindra TCS Appreciating good work competitor Thats makes special Sir,4/6/2019 15:11
Moms Music flashback TCS ,4/6/2019 15:11
Although I anandmahindra UFE Had similar experience Pune city Passport seva Kendras immensely ,4/6/2019 15:10
anandmahindra TCS Sir I received passport day without giving bribe Salute Sushma Swaraj Indian Government,4/6/2019 15:09
anandmahindra Sir one best leader country Appreciation must create leaders like yo ,4/6/2019 15:08
Proud part great organisation TCS whose contribution towards nation DigitalTransformation amazin ,4/6/2019 15:07
RT SahukarShivaraj asifd anandmahindra TCS Thank Nehru UFUF pkmkb AskAnshul,4/6/2019 15:07
anandmahindra TCS Its easy coz businessman bank account millions dollars I applied passport year ago,4/6/2019 15:06
anandmahindra TCS Are throwing weight behind Aadhaar ,4/6/2019 15:06
anandmahindra TCS Very true Government sector offices highly improved world class level ,4/6/2019 15:05
triplecrownspts TCSBB Are games rained PlanoTX Cant find updates website,4/6/2019 15:05
anandmahindra TCS Same I feel last week I renew passport midc Andheri Mumbai Digital way,4/6/2019 15:04
RT FindAnyFilm When last see Steven Spielberg classic RT Follow chance win ultimate S ,4/6/2019 15:02
anandmahindra TCS The police verification process also automated Cops come residence checks ,4/6/2019 15:02
anandmahindra TCS Sir I called passport seva Kendra reissue passport And told bring ol ,4/6/2019 15:02
anandmahindra TCS The PSK processes highly efficient The real roadblock police verification process ,4/6/2019 15:01
anandmahindra TCS So honest appreciate competitor TCS,4/6/2019 15:00
anandmahindra TCS I need help,4/6/2019 15:00
anandmahindra TCS TRUE INDIA TRUE INDIAN Hats Anand Jee You dont hesitate admire good work co ,4/6/2019 15:00
anandmahindra TCS India must developed country billion Indians make Lets unitedly dream mak ,4/6/2019 14:59
anandmahindra TCS It perfect example private public partnership The model used ,4/6/2019 14:56
What marketing skills highly valued amp biggest skill gaps Our ChiefMarketingOfficer ,4/6/2019 14:56
anandmahindra TCS Commendable even went Mr Mahindra first place Its indeed new IndiaUFDUFD,4/6/2019 14:55
anandmahindra TCS Sir tweets always positive appreciative sincere Really admire spirit,4/6/2019 14:55
seriousfunnyguy moronhumor anandmahindra Kapilagr TCS jayantsinha sureshpprabhu HMOIndia So still ,4/6/2019 14:55
krishnaganpat anandmahindra TCS anandmahindra please take look sir,4/6/2019 14:54
DuchessOfSussexs father amp halfsister r always happy give want They use every opport ,4/6/2019 14:54
seriousfunnyguy moronhumor anandmahindra Kapilagr TCS jayantsinha sureshpprabhu HMOIndia But THAT b ,4/6/2019 14:52
anandmahindra TCS experience Malad example Professionalism,4/6/2019 14:52
seriousfunnyguy moronhumor anandmahindra Kapilagr TCS jayantsinha sureshpprabhu HMOIndia In India ano ,4/6/2019 14:49
anandmahindra TCS Sir visiting place ten years I guess,4/6/2019 14:48
prashantmanral ViratKanadia anandmahindra TCS Aadhaar Card,4/6/2019 14:47
Vishupedia moronhumor anandmahindra Kapilagr TCS jayantsinha sureshpprabhu HMOIndia Thats history Last ,4/6/2019 14:47
dpsatish anandmahindra TCS He wont listen Can see tweets r like pro modi Can understand busi ,4/6/2019 14:46
tpbhatla RNTata TCS Thanks lot revert Really appreciate Then must driver trying ,4/6/2019 14:46
seriousfunnyguy moronhumor anandmahindra Kapilagr TCS jayantsinha sureshpprabhu HMOIndia Not really All ,4/6/2019 14:45
zkid All done TCS associates,4/6/2019 14:45
Torrent PharmagtRs L Shares Cadila Health gtRs L Shares TCS gtRs Cr Shares Ultratech C gtRs ,4/6/2019 14:44
anandmahindra TCS Sir owner rival TechM great see appreciating good work TCS done U true business spiritsalute,4/6/2019 14:44
Issk anandmahindra TCS Actually done NaMo implemented UPA first tcs,4/6/2019 14:43
anandmahindra TCS Its eyewash Priviledged like Mr anandmahindra Everywhere else In ,4/6/2019 14:43
anandmahindra TCS SushmaSwaraj This path breaking initiative taken Government long time back Outstanding stuff,4/6/2019 14:43
tpsreekumar anandmahindra TCS With Aadhaar step directly coffin n bury inside house,4/6/2019 14:43
anandmahindra TCS Very Down To Earth MD anandmahindra,4/6/2019 14:42
Early bird tickets Awful Auntie Bloomsbury Theatre £ TampampCs Event dates Friday th December ,4/6/2019 14:42
anandmahindra TCS Very true I got daughters passport done months oldthe process ,4/6/2019 14:41
moronhumor seriousfunnyguy anandmahindra Kapilagr TCS There many countries Only countries dont stamp exiting,4/6/2019 14:41
anandmahindra TCS Yes passport hs super fast last years SushmaSwaraj,4/6/2019 14:41
RT SahukarShivaraj asifd anandmahindra TCS AskAnshul Once Nehru planted tree Thanks Nehru oxygenUFUFUFUFB,4/6/2019 14:40
anandmahindra TCS This new India Shining India Progressive India Sir,4/6/2019 14:39
moronhumor seriousfunnyguy anandmahindra Kapilagr TCS I disagree Any additional security measures fir India ,4/6/2019 14:39
anandmahindra TCS This operational way,4/6/2019 14:38
anandmahindra TCS I like color staff ID card tags Really colorful like wonderful colorful country,4/6/2019 14:38
anandmahindra TCS Thank Sir comments,4/6/2019 14:38
anandmahindra TCS rajeshdogra ramanvenkatram Business gets best applause,4/6/2019 14:38
