Text,date
anandmahindra TCS I visited Post Office PSK small town Chitradurga yesterday renewal It breeze ,4/6/2019 8:25
anandmahindra TCS YesThanks Lot To Congress GovtManmohan Singh Ji,4/6/2019 8:25
anandmahindra TCS You lucky Here Passport Seva Kendra Gurugram even renewal sending police verification,4/6/2019 8:25
RRBKOLKATA TCS PiyushGoyal ln alp cbt different beetween master QP final Answer key In master QP Que ,4/6/2019 8:24
saralouprend Not next week Chem revision session Monday th April This Easter holiday,4/6/2019 8:24
WeArePlayground ForzaMotorsport forzasupport Since launch Ive encountering small bug game FH ,4/6/2019 8:24
anandmahindra TCS Aadhar makes life simple,4/6/2019 8:23
gamesjosling anandmahindra TCS Ah thank together team work sure thing drasticall ,4/6/2019 8:23
anandmahindra TCS Yes thanks Manmohan Singh come great idea,4/6/2019 8:23
lewislos King Wayne Greatest,4/6/2019 8:22
RT ompraka anandmahindra TCS This good quality legend Anand Mahindra He always appreciate good things After go,4/6/2019 8:22
anandmahindra TCS Credit goes beloved SushmaSwaraj mam,4/6/2019 8:21
anandmahindra TCS Addhar important credit gos manmohan Singh,4/6/2019 8:21
anandmahindra TCS For last years PSK across country excellent jobs,4/6/2019 8:21
anandmahindra TCS Process efficient citizen,4/6/2019 8:21
anandmahindra TCS Sir donno I always loved totally different businessman ,4/6/2019 8:21
anandmahindra TCS This good quality legend Anand Mahindra He always appreciate good things After ,4/6/2019 8:21
anandmahindra TCS Completely agree Have experience Works like magic time And unbelievable scale,4/6/2019 8:21
anandmahindra TCS sir aadhar card managed passport whateve TCS fantastic job,4/6/2019 8:20
anandmahindra TCS Ye team great job Sir Systematic amp prompt service Within half hourmy passpo ,4/6/2019 8:20
krishna anandmahindra TCS Tcs handling passport functionality government,4/6/2019 8:20
anandmahindra TCS always believed companies industry competitors try every mea ,4/6/2019 8:20
cspavmar anandmahindra TCS Will take couple generations continues efforts start Babus ,4/6/2019 8:20
anandmahindra TCS Aadhaar Idea CongressUFE,4/6/2019 8:20
anandmahindra TCS But TCS,4/6/2019 8:19
anandmahindra TCS This new digital INDIAUFEEUFF,4/6/2019 8:19
anandmahindra TCS Will able embed heads ever one source revenue ,4/6/2019 8:19
anandmahindra TCS Indeed,4/6/2019 8:19
anandmahindra TCS Most importantly brought smile many unknown unseen faces simply making ap ,4/6/2019 8:19
anandmahindra TCS And still people abusing MEA Sushma Swaraj ji twitter days ago,4/6/2019 8:19
anandmahindra TCS If say like become Sanghi Sir,4/6/2019 8:18
anandmahindra TCS But back end still useless govt babu sitting trying harass every single p ,4/6/2019 8:17
anandmahindra TCS Wonderful see Personalities setting examples Once day ordinary citizen UFA,4/6/2019 8:17
anandmahindra TCS Ration shops medicine outlets bus stops hospitals schools etcplz visit give fee ,4/6/2019 8:16
anandmahindra TCS Its new India Sir So must extend support development country,4/6/2019 8:16
RRBKOLKATA TCS PiyushGoyal ln alp cbt instruction rrb say In case variation content quest ,4/6/2019 8:16
anandmahindra TCS This old thing Ahmedabad since Years,4/6/2019 8:16
anandmahindra TCS UPA government,4/6/2019 8:16
anandmahindra TCS things really become faster easy different levels,4/6/2019 8:15
anandmahindra TCS Sir careful many pseudo liberal might call Bhakt,4/6/2019 8:15
anandmahindra TCS Sir I family th March BLR passport office The support good W ,4/6/2019 8:15
anandmahindra TCS I completely agree Sir Couple months back I went book passport family I ,4/6/2019 8:15
anandmahindra TCS We need anandmahindra every Indian citizen leader More power sir,4/6/2019 8:14
anandmahindra TCS Absolutely,4/6/2019 8:14
Exclusive Up Glamping Browning Brothers Teybrook Farm near Colchester TampampCs day sta ,4/6/2019 8:14
anandmahindra TCS Looks nice appreciate TATA Their services,4/6/2019 8:13
anandmahindra TCS Truly great transformation,4/6/2019 8:13
anandmahindra TCS Anand hi Anand passport seva kendra UAUAUFDUFD,4/6/2019 8:13
anandmahindra TCS Hope resiprocated use common citizens country,4/6/2019 8:13
anandmahindra TCS True really fast,4/6/2019 8:13
anandmahindra TCS Just hope way become contributor development country,4/6/2019 8:13
anandmahindra TCS Sir front end privatized But last counter might find ministry officials,4/6/2019 8:13
Tiger roll wants pull bag today like Got lot big ones riding Make happy Ellio ,4/6/2019 8:12
Ready ELCC Here best myESMO IASLC selected abst oral presentation comments UFEFUECM ,4/6/2019 8:11
Needed new passport book amp visited Passport Seva Kendra Parel Mumbai I saw new IndiaA worldclass te ,4/6/2019 8:11
rrbsecunderabad RRBKOLKATA RailMinIndia TCS RailwaySeva SCRailwayIndia What need Normalization Ke ,4/6/2019 8:11
RT Morrisons Show Mum shes number one Number Mum bouquets £ The ideal gift MothersDay Fo,4/6/2019 8:07
Times change taste design The new classics clean lines mono colours theme ,4/6/2019 8:00
Hey TCS BaseballTCSPostGrad thank following,4/6/2019 7:56
RCB fans go Chinnaswamy stadium every week disappointed The last time people came smili ,4/6/2019 7:49
thedumbtrader Dear Sir view TCS coming week,4/6/2019 7:46
AbhilashMBLR shyjithk Rupsi ECityRising PranayDubey RandeepDev maniias hdkumaraswamy BBMPMAYOR ,4/6/2019 7:22
Efforts reduce GHG emissions even conventional energy producing assets viz LNG goes Canada ,4/6/2019 7:20
metalsolutions supply ROOFINOX Tin Matt The Grade Tern Coated Stainless Steel TCS This malleable Austen ,4/6/2019 7:17
ECityRising AmithaBala PranayDubey RandeepDev maniias hdkumaraswamy BBMPMAYOR DrParameshwara ,4/6/2019 7:17
RT FindAnyFilm When last see Steven Spielberg classic RT Follow chance win ultimate S ,4/6/2019 7:11
RT ghostoflynn I find hard believe drew knows conspicuous means ghostofamanda discussion tcs wdy,4/6/2019 7:11
I find hard believe drew knows conspicuous means ghostofamanda discussion tcs wdyl,4/6/2019 7:11
BJPBengal MamataOfficial Software companies expanding fast Bengal TCS employs people WIPRO employs ,4/6/2019 7:07
AmithaBala PranayDubey AbhilashMBLR RandeepDev maniias hdkumaraswamy BBMPMAYOR DrParameshwara ,4/6/2019 7:04
Mobile Application Market A comprehensive study Key Players Accenture Pricewaterhouse Coopers Wipro TCS ,4/6/2019 7:03
EMchat Spending bulk time today working layout content new TCS admissions website UFBB I ,4/6/2019 7:02
RT TCSNewark At Total Care Security Traffic Marshals supported security guards They work one team providing complet,4/6/2019 7:00
TCSNews But u r good making paper ssc especially GS section,4/6/2019 7:00
RT TCSBaNCS CTBC Bank Taiwan selects TCS BaNCS accelerate growth enter new markets Know  ,4/6/2019 6:59
RT CAYsil Tomorrow Sunday last date payment TCS collected challan noINTS amp submit form No CTCS rec,4/6/2019 6:54
actorprashanth Congratulations,4/6/2019 6:53
LEGO® Star Wars TCS  ,4/6/2019 6:50
ChaluPandey Your view TCS sir Votekar,4/6/2019 6:50
TCS Thorn Speed Paint ,4/6/2019 6:50
RCB fans go Chinnaswamy stadium every week disappointed The last time people came smili ,4/6/2019 6:43
AmithaBala ECityRising AbhilashMBLR RandeepDev maniias hdkumaraswamy BBMPMAYOR DrParameshwara ,4/6/2019 6:36
Tomorrow Sunday last date payment TCS collected challan noINTS amp submit form No ,4/6/2019 6:36
RT FalpalsChoice speaking thank noteshave entered thank notes contest yet Tweet best funniest thank yo,4/6/2019 6:32
RT LutonQuakers Volunteer The Childrens Society Marsh Road Leagrave TCS Church England based charity helping vulner,4/6/2019 6:27
TCS Why mandate educational gaps years company Could genuine reasons w ,4/6/2019 6:18
PranayDubey ECityRising AbhilashMBLR RandeepDev maniias hdkumaraswamy BBMPMAYOR DrParameshwara ,4/6/2019 6:18
shyjithk PranayDubey ECityRising AbhilashMBLR RandeepDev maniias hdkumaraswamy BBMPMAYOR ,4/6/2019 6:16
BSidesSATX acdgoddess TheDrPinky I want buy shirt I I marching June th I wont ,4/6/2019 6:14
scully Super mario sunshine basically everything game needs fixed Skyward sword rely less mot ,4/6/2019 6:12
PranayDubey ECityRising AbhilashMBLR RandeepDev maniias hdkumaraswamy BBMPMAYOR DrParameshwara ,4/6/2019 6:12
RT pachisiasourav TCS Result th Chart says trade result season Sharing educational purpose adv,4/6/2019 6:12
TCS Result th Chart says trade result season Sharing educational purpose ,4/6/2019 6:03
Interesting Charts Week Ahead Banknifty Bel Dbcorp Gold Comex Hdfc Icicipru Jswsteel Lupin ,4/6/2019 6:00
TCS wins core replacement National Bank Bahrain banking corebanking ,4/6/2019 6:00
TeeeTv pxics itssBs lukiq JMitcsgo TCSBray flashyycsgo ScrptCS ScrptCS sounds right bot,4/6/2019 5:57
Feel curves dry wet ride slow UAUFEF Btw effective TCS oil spills Shot ,4/6/2019 5:57
pls tell TCS Infosys Wipro basically IT company ,4/6/2019 5:56
TCS employee ends life due inlaws harassment Hyderabad ,4/6/2019 5:50
RT EProspectsCA TNL u Gold u Pool play TCS February Frost Santee CA UFEUFUFAAUFFCUFE ,4/6/2019 5:45
Iron Man pxics Black Widow itssBs Thor ExaammpLCS Cap America lukiq Hulk JMitcsgo Antman ,4/6/2019 5:44
RT EProspectsCA TCS February Frost u Gold Bracket Champions run differential TNL Power Surge Chavez Championship,4/6/2019 5:44
Keirwales wrecksh Factual correction Naomi unit ED unit still open partial TC Acorn f ,4/6/2019 5:37
RT tnlsoftball u amp u teams MASH TCS Monster Mash San Diego combine move Gold Bracket play UFUFCUFFB EPTakesItToTheNex,4/6/2019 5:32
RT EProspectsCA UFATNL u u grab st seed undefeated Saturday pool play TCS PreThanksgiving Cup BIg League Dream,4/6/2019 5:31
Indian IT outsourcing firms making comeback job market The net employee addition Infosys TCS w ,4/6/2019 5:12
RohitGylMuslate RNTata TCS Rohit run AC cabs months summer starting st April nonAC c ,4/6/2019 5:11
After TCS HCL Sued For Discriminating Against Americans During Hiring  ,4/6/2019 5:10
KerryContrary TCs end us,4/6/2019 5:08
Watch final FUCCL FLAME University Corporate Cricket League LIVE campus right ,4/6/2019 5:07
Currently finishing work TCS Have new onslaught assignments next week surprise going ,4/6/2019 5:00
TCS recently announced partnership Microsoft insider Technology develop crossindustry ,4/6/2019 5:00
Job Job opening TCS SAP BASIS With Hana Permanent position Interview th April ,4/6/2019 4:59
Rupsi ECityRising PranayDubey RandeepDev maniias hdkumaraswamy BBMPMAYOR DrParameshwara ,4/6/2019 4:52
fanstanetwork TickPick FanstaTickPickMe SOSTCS Nov chase center tickets,4/6/2019 4:51
RT MySquareSCW Figure names favourite dishes hidden puzzle win TrickyTuesday Follow link TampCs htt,4/6/2019 4:49
Contest IndianPropertyLeague Which city Investment Hotspots Hyderabad Mumbai Hint Click ,4/6/2019 4:40
RMGamesDev hiI problem playing TCSall phones machines working pc monitor mac ,4/6/2019 4:38
I pray friends family find peace happiness lives UFFUFFE,4/6/2019 4:38
TCS performed love ATT I missed UFDUFD,4/6/2019 4:38
Since tweet slick blowing shameless plug My friend KeyShawn running SGA president elections st ,4/6/2019 4:35
Hi RajeshGopinathan sir TCS gone corrupt Your Managers practicing Favouritism yet good office p ,4/6/2019 4:30
fonzibonzisos making MAD BC ALL OF THE SOS CONTENT HAS TCS TOO UFUFUFUF,4/6/2019 4:26
The allocation HB work visas following IT companies declined whopping ,4/6/2019 4:26
I want SOS similar live stream TCS Dudeee magical,4/6/2019 4:26
Hi Twitter Android UF lol thing people dont know answerUF dont get ,4/6/2019 4:19
Indian IT Giant TCS Developing Multiple Blockchain Platforms ,4/6/2019 4:10
TCS Confused TradingView ,4/6/2019 4:10
If participating australianrunnigfest runner spectator make sure download powered TC ,4/6/2019 3:44
DRMbhopal Jeebankumar RRBKOLKATA rrbmalda rrbsecunderabad TCS PiyushGoyal Plzzzz fastly otherwise p ,4/6/2019 3:42
TCS Drive Adoption Blockchain Solutions Built Microsoft ,4/6/2019 3:41
speaking thank noteshave entered thank notes contest yet Tweet best funniest tha ,4/6/2019 3:34
promise ive kept mind keep missing tcs n ,4/6/2019 3:31
Thank association New Year wish luck prosperity health look forward conti ,4/6/2019 3:30
Week Plastic Waste Cleanup Drive Hyderabad weeks go PeopleTCS CleanIndia SwachhBharat ,4/6/2019 3:26
RT TCSDigitalBiz Never miss opportunity channel continuous innovation building agile culture Register meet,4/6/2019 3:25
HB visa restrictions compel Indian tech firms hire locals Report Out top three companies hi ,4/6/2019 3:21
RT imimd He must Infosys IBM TCSkuch bhi hojayeProcess follow karneka UCUFUF ,4/6/2019 3:12
rolandscahill Oh hell yeah Corduroy shorts feathered back hair pooka shell necklace I savage,4/6/2019 3:10
pratyasharath arunbothra No Passport pics really good TCS good cameras offices AADHAR horrible,4/6/2019 3:05
VivekKNair PranayDubey ECityRising AbhilashMBLR RandeepDev maniias hdkumaraswamy BBMPMAYOR ,4/6/2019 3:02
RT calumslizard kidding tcs mampg mean guess id sell em make bank ,4/6/2019 3:00
TCSBB cap city invitational far weather updates tournament director return textscalls I u ,4/6/2019 2:47
whaleman dannythehoodrat VarsityTheater Hell backhe loves TCs said ,4/6/2019 2:41
Software companies expanding fast BestBengal TCS employs people WIPRO employs Cognizant employs ,4/6/2019 2:34
RT SOSKillUs Stream kills slowly havent TCS Thank ,4/6/2019 2:30
VeraEtches ottawahealth ottawacity Where link Where online,4/6/2019 2:27
VeraEtches EliElChantiry tmkavanagh StephenBlais ottawacity It would helpful residence along r ,4/6/2019 2:26
ItsDiaMalik TCS Please,4/6/2019 2:18
RT HillaryClinton If junioryear college students life make sure know Organizing Corpsan eightweek pai,4/6/2019 2:11
ViralNews This IT firm HB visa denials last year Infosys TCS combined The Financial Expres ,4/6/2019 2:01
MrsMcDuff LuvGroove This pretty hard kids,4/6/2019 1:57
cgiridhar PUMA Running TCS k,4/6/2019 1:50
RT SoyoungPark Great evening IDRCinAsia Working India since supporting projects Thanks JeanLebel,4/6/2019 1:47
PiyushGoyal narendramodi Aapke time exam rrb ne jo ganda majak students ke sath kr rha ha uska bhi chouk ,4/6/2019 1:45
RT Jeebankumar RRBKOLKATA rrbmalda rrbsecunderabad TCS type injustice nd st students Firstly normalisation,4/6/2019 1:38
IRLGOLDIE Aye good af ,4/6/2019 1:30
tcs im dEad UFD,4/6/2019 1:29
IRLGOLDIE Yeah name catchy I hungry I got coupon mail like shit UFUFFDUDUUFEF I ,4/6/2019 1:27
RT tyrone You see kill us race doesnt even come Yet wire man opened fire black family road rag,4/6/2019 1:25
tcs I remeber tried cuz name UFUFFFUDUUFEF UFB,4/6/2019 1:25
Social Emotional LearningUF Sometimes need reminded sometimes need taught Either way ,4/6/2019 1:21
RT TCSCognitiveBiz ArtificialIntelligence poised turbocharge analytics technologies Our dinakholkar shares managers lev,4/6/2019 1:15
RT TCSCognitiveBiz Predictive maintenance enabled IoT killer app intelligentautomation global spending predicted g,4/6/2019 1:15
RRBCWendyScottBirthday Celebrate picking one amazing RRBC RWISA Authors books WendyJayneScott ,4/6/2019 1:15
RT TCTigersonline Seniors kindergarten shared moment caps gowns Prayers hugs starting endin,4/6/2019 1:06
michael tcs anything ,4/6/2019 1:00
Im ndwbb WFinalFour GoIrish ,4/6/2019 0:51
terrygoonline Lie brake check TCs,4/6/2019 0:50
Smh bro really got TCS Im sickUF,4/6/2019 0:04
WSSOFFICIAL Akon touchskygroup AhmerKunwar TouchSkyGroup wearedr YayvoTCS Can please send ,4/5/2019 23:55
 TCS Arch Summit,4/5/2019 23:53
RT willneal The Cambridge Student Peterson Doesnt Deserve Cambridge Fellowship Hes Deeply Mediocre ,4/5/2019 23:50
Congratulations DreyfoosSOA musicians great concert tonight Im proud former TCS violist Ha ,4/5/2019 23:49
RT millionairemob Anyone invest commercial real estate earn passive income Heres everything need know ,4/5/2019 23:46
RT CFCMod Guess left us save England April th Weve got ,4/5/2019 23:41
Jo Boaler Graham Fletcher Marilyn Burns This Math Coach Cloud This valuable confere ,4/5/2019 23:25
TCS named top US brand ,4/5/2019 23:25
SGalls tcsna DiscoveryEd kimberlywright Love SGalls It looks like fantastic time,4/5/2019 23:19
nmrickard melissa Junobeachgirl Wow Bryce telling Venice So sweet come share class,4/5/2019 23:15
RT YourDrunkHubby One days Im going spend hours replying yalls tweets exactly I think By en,4/5/2019 23:14
RT SylvanianUK Its NationalToothFairyDay Instead finding coin pillow would like win Baby Shopping Serie,4/5/2019 23:06
One days Im going spend hours replying yalls tweets exactly I think By th ,4/5/2019 23:06
fanstanetwork TickPick FanstaTickPickMe SOSTCS tickets November rd,4/5/2019 23:02
need new content isnt associated w tcs,4/5/2019 22:52
internetrebecca datasociety CenDemTech EPICprivacy accessnow EFF And course ,4/5/2019 22:47
Want know G affect eSports enable new interaction models consumption formats amp content types Don ,4/5/2019 22:45
If anybody wants get early grad gift UF UF ,4/5/2019 22:44
TCS SAP teaming transform rail transportation industry innovative drone amp predictive maint ,4/5/2019 22:40
BreakingNews This IT firm HB visa denials last year Infosys TCS combined The Financial Exp ,4/5/2019 22:34
TCSANZ tpgievents Congrats TCSANZ amp thx support RunSweatInspire ShareTheStory,4/5/2019 22:29
RT TCSBBQCRIB Join us TCSBBQCRIB great food good times tcsbbqcrib tcs bestbbq bestsauce bestsides bestribs delivery,4/5/2019 22:27
tcsud provides opportunities students show empathy develop socialemotional awareness ,4/5/2019 22:26
Predictive maintenance enabled IoT killer app intelligentautomation global spending predicted ,4/5/2019 22:26
RT caelgrabowski Idk needs hear company makes Lantus insulin coupon website brings cost,4/5/2019 22:22
magento TCS Great work UFCUFFD,4/5/2019 22:20
RT AttyAbdul Glad help hammerandnigel amp chicksonright filling week wibc folks springbreak week htt,4/5/2019 22:16
TCSs Quartz enables bankspayments systems connect DLT based payment infrastructures like RippleNet ,4/5/2019 22:15
Before revamping CX channel transition plans place IT systems If heres check ,4/5/2019 22:10
tcs Lol deserves half UFFUFFDUFFUFFD,4/5/2019 22:07
mojomofo I see lol fool picture tuff UF Shea looking right,4/5/2019 22:05
tcs People dont catchin I sayin sometimes UF,4/5/2019 22:04
If fleet trucks youre busy need fuel card works hard Thats ,4/5/2019 22:04
mojomofo Ive scrolled past picturelike times going TL Im realizing caption says UFUFUF,4/5/2019 22:03
RT TomHall The Northern Lights Aurora Borealis Southern Lights Aurora Australis produced Earths magnetospher,4/5/2019 22:03
Congrats TCSArts amazing leader arts advocate Thanks making sure students TCS hav ,4/5/2019 22:03
The Minnedosa United Church AOTS Pancake Supper NOW pm Adults  ampU  TCS Jr High LSN Club serving,4/5/2019 22:01
RT AllTimeEDM This album year Avicii ,4/5/2019 21:58
What great end fantastic week tcsna DiscoveryEd IgniteMyFuture kimberlywright CindyWallace ,4/5/2019 21:57
DRMbhopal Jeebankumar RRBKOLKATA rrbmalda rrbsecunderabad TCS PiyushGoyal Please sir increase vaccencie ,4/5/2019 21:51
DRMbhopal Jeebankumar RRBKOLKATA rrbmalda rrbsecunderabad TCS PiyushGoyal Sir please increase vaccencies fo ,4/5/2019 21:49
Its beautiful day KnightsBaseball perfect day honorary bat boy Covenant st grader Lee Rober ,4/5/2019 21:49
kidding tcs mampg mean guess id sell em make bank ,4/5/2019 21:46
RT AmikaAlert Amika Mobile happy share news US GOVIES th year row best emergency communications,4/5/2019 21:45
Ghostfan I dont HAVE TCs clumsiness And I change avi personal photo editor sends new material So shove,4/5/2019 21:42
Jeebankumar RRBKOLKATA rrbmalda rrbsecunderabad TCS PiyushGoyal Matter forwarded rrb official,4/5/2019 21:42
zakiavelliv  I use Aero version,4/5/2019 21:36
RRBKOLKATA rrbmalda rrbsecunderabad TCS type injustice nd st students Firstly normalisati ,4/5/2019 21:35
RT TCSDigitalTech Supplychains disrupted alarming pace Join Premier sponsor TCS booth GartnerSCC insigh,4/5/2019 21:32
ItsLukeSOS tcs mampg tixUFC thanks UBUFFCUAUFFC,4/5/2019 21:28
Big thanks SGalls leading breakout sessions sudol capturing amazing moments mentorship betwee ,4/5/2019 21:27
The ImagineExcellenceAwards finalists BEST BB INNOVATIONS GoDirect Trade Honeywell Tata Consulta ,4/5/2019 21:24
We began journey looking UX design thinking Thanks MsABahri guiding yr DLL DT p ,4/5/2019 21:18
Security Lady looked backpack asked inside looked I said bunch PokÃ©mo ,4/5/2019 21:17
Come support Canadian Export Challenge event Mississauga June th StartupCanada ,4/5/2019 21:17
RT TCSDigitalBiz According Gartner large enterprises adopt agile know makes transition agil,4/5/2019 21:16
At nd annual STEMGoesRed AHANewYorkCity event NYC helped inspire female HS students towards ,4/5/2019 21:16
RT kibblesmith Flying today Im already anxious thing TSA yell didnt last time Jackets stay,4/5/2019 21:16
CharlesMiller thistallawkgirl Didnt I see last episode To Catch Predator,4/5/2019 21:15
RT subgg Announcement Apex Tournament happening This time minor quality life changes casted Su,4/5/2019 21:15
RT ChasButtigieg Really enjoyed meeting stellar folks Newseum tour RiseUpTheExhibit commemorating th annive,4/5/2019 21:14
RT JeffGooder HR needs coupled HB reform stop abuse TCS Infosys Cognizant like companies These compa,4/5/2019 21:04
RT DLind Good lord I wish people paid even half much attention administration actually immigration,4/5/2019 21:03
ItsLukeSOS Tcs mampg tix dont birthday,4/5/2019 21:02
RT JasonSSmith WSJ Youve made national Dem candidate WSJ targets Nice job PeteButtigieg,4/5/2019 21:02
PiyushGoyal Dear sir Company TCS largest IT sector Has declared th times result RRB ,4/5/2019 20:54
well dn chocolate milk party SOSKillUS yall really think mental capaci ,4/5/2019 20:53
MichaelCMcCrac thistallawkgirl realDonaldTrump Horse shit I live San Diego I see border every da ,4/5/2019 20:46
Our work nyrr TCS New York City Marathon Course Strategy Application NYRR RUNCENTER Digital Scre ,4/5/2019 20:38
Acosta The thing doesnt even standing fight These records retrievable panel matter law,4/5/2019 20:38
RT KamalaHarris Americans deserve see full Mueller report short summary Trumps handpicked Attorney General Period,4/5/2019 20:36
RT jonlovett Pretty clear one asked Howard Schultz hard question literally television running president,4/5/2019 20:36
Check ,4/5/2019 20:35
TCS This Proper grotter,4/5/2019 20:28
ScienceTCS Will revision sessions students set,4/5/2019 20:28
rrbmumbai Difference shame bord TCS Normilasiton mark alp technician increase ,4/5/2019 20:21
chestermatt My insides fucked Tramp whoever,4/5/2019 20:18
RT julidiaz Last Day HIW successful exciting week Our TCSSDC stand open MaRSDD questions,4/5/2019 20:18
RT DeborahRH Have filed IP Thats first question TCSSDC going ask targeting China market chris,4/5/2019 20:17
Barclays TCS team help children locomotor disabilities ,4/5/2019 20:06
Are hearing lot CanExport funding still questions Check FAQ page youll find ,4/5/2019 20:01
We proud recognized BrandFinance Top US Brand fifth consecutive year We honored ,4/5/2019 20:00
RT BBMAs BBMAs Top DanceElectronic Album UF cleanbandit What Is Love UF davidguetta  UF KygoMusic Kids Love UF MAJORL,4/5/2019 19:53
RT thegreatkhalid I wanna cowboy baby,4/5/2019 19:52
IT services revenue margin performance GFC cc    IN   nature digital wor ,4/5/2019 19:50
Swag Bag Prize TCS technology tweeting technology action trussvillelearns cahabalearns ,4/5/2019 19:46
RT yourex TCS karden khat ,4/5/2019 19:42
JeffreyLuscombe Yep Those three favs Warren deepest weeds policy Buttigieg fresh ,4/5/2019 19:42
In Kills You Slowly tcs drew sounds like Niall like Zayn thats closest thing D reunion,4/5/2019 19:42
TCS karden khat ,4/5/2019 19:41
TCS Long TCS TradingView ,4/5/2019 19:40
Patients AD received baricitinib mg plus topical corticosteroid achieved improvement Ecze ,4/5/2019 19:36
RT MrDane Hillary Clinton released years tax returns Hillary Clinton beat Bernie Sanders M votes Hillary Clinton beat Do,4/5/2019 19:33
RT ohhoe Then I got told I absolutely couldnt speak anymore traveling put sales engineering project C wh,4/5/2019 19:33
RT LaurieAnneKing Thank UUapaieU excellent conferenceexpo Looking forward APAIE Vancouver March EduCanad,4/5/2019 19:33
TCS New York City Marathon Mr Michael F McCaffery Freds Team If spare buck two I run mem ,4/5/2019 19:31
PranayDubey ECityRising AbhilashMBLR RandeepDev maniias hdkumaraswamy BBMPMAYOR DrParameshwara ,4/5/2019 19:30
RT fromeleo What great TCS MaRS partnership yingtam TCSSDC MaRSDD HIW CanadaHIW TimeToDiversify ,4/5/2019 19:28
What great TCS MaRS partnership yingtam TCSSDC MaRSDD HIW CanadaHIW TimeToDiversify ,4/5/2019 19:27
It comes tomorrow nuwbball ArizonaWBB battle WomensNIT crownUF pm ET ,4/5/2019 19:11
Congratulations amazing students nominated teachers school personnel Our monthly c ,4/5/2019 19:10
Amika Mobile happy share news US GOVIES th year row best emergency communi ,4/5/2019 19:07
RT tcsdealer The TCS Way Be strong rude Be kind weak Be humble timid ,4/5/2019 19:01
Were collaborating StartupCanada UPSSmallBizCA amp ExportDevCanada present second Canadian Export ,4/5/2019 19:00
ArtificialIntelligence poised turbocharge analytics technologies Our dinakholkar shares managers ,4/5/2019 19:00
RT KamalaHarris No parent think buying child bulletproof backpack keep safe school Inaction,4/5/2019 18:59
RT ProudResister Thank coach MuffetMcGraw Can please Americas coach ,4/5/2019 18:58
Google hires IIMs Microsoft hires IITs TCS hires NITs RCB hires Dinda School Bowling ,4/5/2019 18:56
maggieNYT Opperandi Gawd autocorrect edit button tweet pretty horrible,4/5/2019 18:55
