Text,date
jimcarrwpg TCSSDC You forgot mention anything giving taxpayer money friends donors,4/9/2019 22:41
Ministry Metro Kids today TCS th grade missions East Harlem ,4/9/2019 22:40
The top companies Forbes list Software amp Programming sales AlphabetUFFAUFF B ,4/9/2019 22:35
jimcarrwpg JustinTrudeau TCSSDC When frightened talk Diversity Feminism give away lots mone ,4/9/2019 22:35
anandmahindra TCS Tech good yes officers still dumb Had tweeted abt sushmaji nothing happened,4/9/2019 22:35
RT GenevieveSack Great Chief Trade Commissioner AilishCampbell Washington DC today successful meetings including th,4/9/2019 22:30
TCS LOOKING GOOD NSE ,4/9/2019 22:30
Thank senrobportman supporting Ohio teachers participated Cincinnati IgniteMyFuture program amp ,4/9/2019 22:30
TCS CXAssurance Platform evaluates CX maturity score also reduces timetomarket new features ,4/9/2019 22:25
RT paskitaprod back work first ,4/9/2019 22:21
jimcarrwpg JustinTrudeau TCSSDC If Trudeau broke law kicking former ministers caucus Philpot ,4/9/2019 22:21
jimcarrwpg JustinTrudeau TCSSDC You wont hob October,4/9/2019 22:20
TCS TCS A SHORTING CANDIDATE FOR INTRADAY SWING TradingView ,4/9/2019 22:20
jimcarrwpg JustinTrudeau SDCTCS This nonsense entire career international business I would ap ,4/9/2019 22:05
sentosuxmosaba sentosumosaba TCS IMFNews Are u serious,4/9/2019 22:03
Reasons Why Mindfulness Is So Important Classroom  edchat educhat ,4/9/2019 22:00
CanadianBeave coffeeandvinyl I mustve screwed Werent assigning TCs morning,4/9/2019 21:59
jimcarrwpg JustinTrudeau TCSSDC How pipelines coming along,4/9/2019 21:56
jimcarrwpg JustinTrudeau TCSSDC STOP HUFFING,4/9/2019 21:55
RT ygkjohnvince Glad still moments Fac Ed SparkJoy TCs visit  let darylkramp,4/9/2019 21:54
jimcarrwpg JustinTrudeau TCSSDC By Liberals joke,4/9/2019 21:52
Glad still moments Fac Ed SparkJoy TCs visit  let darylkramp ,4/9/2019 21:52
anandmahindra TCS So true PSKs great job But elements efficient Especially Po ,4/9/2019 21:49
The Ins Outs Booking Freelancers  thecreativestore creativetalk freelance ,4/9/2019 21:46
jimcarrwpg TCSSDC CNN criticism partys past gtgtgtgt GEEZ SOUNDS LIKE CASH FOR ACCESSSHADY DEALS ,4/9/2019 21:43
jimcarrwpg JustinTrudeau TCSSDC Resign Canadian Hater,4/9/2019 21:42
RT sushantpande Meet TCS Team th April TCSPartnerSpotlight learn leveraging Pega Assets amp Accelerators,4/9/2019 21:42
jimcarrwpg TCSSDC CNN WATCH THIS ,4/9/2019 21:41
Meet TCS Team th April TCSPartnerSpotlight learn leveraging Pega Assets amp Acceler ,4/9/2019 21:40
USRepGaryPalmer please help give TCs dispatchers recognition deserve supporting Rep ,4/9/2019 21:39
SenShelby please help give TCs dispatchers recognition deserve supporting Rep ,4/9/2019 21:39
sendougjones please help give TCs dispatchers recognition deserve supporting Rep ,4/9/2019 21:39
jimcarrwpg TCSSDC China wrote chunk Cameroons debt So secrecy CNN ARE THEY TALKING ,4/9/2019 21:39
jimcarrwpg JustinTrudeau TCSSDC But real world ,4/9/2019 21:39
jimcarrwpg TCSSDC hes given money Biyas government enjoys cordial relations long time le ,4/9/2019 21:38
jimcarrwpg TCSSDC Chinas policy nonintervention another countrys domestic affairs strengthene ,4/9/2019 21:38
jimcarrwpg TCSSDC TRADE WARS HAIL PUTIN HAIL CORELEADEREMPEROR FOR LIFEBIG DADDYWINNIE THE POOH ,4/9/2019 21:37
jimcarrwpg TCSSDC GOOD REMEMBER NAZI GERMANY AND DONT FORGET ALL THOSE POLITICIANSbusinessmen WHO SAID H ,4/9/2019 21:37
jimcarrwpg TCSSDC WORLD AND MILITARY DOMINATION THREATDICTATORSHIPETC COMMUNIST CHINA WILL HAVE A COM ,4/9/2019 21:36
TukwilaPD Hi Live Storm Chasers would like know would open allowing us rebroadcast fully acros ,4/9/2019 21:36
jimcarrwpg TCSSDC WHITE GLOVES ARE RED BEING SOAKED IN SO MUCH INNOCENT BLOOD WHEN ARE BUSINESS PEOPLE GOI ,4/9/2019 21:36
CarolynMorrisro WLOS NWSGSP Hi Live Storm Chasers would like know would open allowing us ,4/9/2019 21:36
jimcarrwpg TCSSDC Gong CHRISTIANS ETCANY CANADIAN  FLOWING TO COMMUNIST CHINA KEEPS HUMANRIGHTS ABUSING ,4/9/2019 21:35
jimcarrwpg TCSSDC MORE BUSINESS WITH COMMUNIST CHINA AECONHUAWEIGUESS SHADY DEALS ARE THE WAVE OF THE ,4/9/2019 21:34
Canada CanadianBiz invited attend TCSSDCs Open House Edmonton Thursday learn ,4/9/2019 21:31
ASAPOMA acousticsorg Hmmm Good question ASAPOMA Seems kind bind everyone Council ,4/9/2019 21:31
CanadianBiz invited attend TCSSDCs Open House Edmonton Thursday learn exporti ,4/9/2019 21:30
A Union Pacific freight pulls hard grade shed ten All locomotives Tcs wow diesel ha ,4/9/2019 21:27
jimcarrwpg JustinTrudeau TCSSDC You wont around long enough implement programs jimmy boy You mi ,4/9/2019 21:26
jimcarrwpg JustinTrudeau TCSSDC We need happen cant dependent year term president ,4/9/2019 21:24
jimcarrwpg JustinTrudeau TCSSDC Mr Carr You aim want FAIL It impossible ,4/9/2019 21:24
RT saytruuuth SwitzerlandUFEUFEDUFEUFEDUFEUFED NICKIMINAJ JuiceWRLD COMING NickiWRLDTour next week UF  March Zurich Hall,4/9/2019 21:22
jimcarrwpg JustinTrudeau TCSSDC Canadians good people STOP calling Racist Islamaphobic antigay h ,4/9/2019 21:22
My biases AngelList developer search Not shortlisting people commits Github ones ,4/9/2019 21:20
jimcarrwpg JustinTrudeau TCSSDC UFEUFE needs break dependency US Its dangerous,4/9/2019 21:19
What better way celebrate NationalLibraryWeek STEMthemed books courtesy UtcsnaU UTataCompanies ,4/9/2019 21:18
RT grannycindy jimcarrwpg JustinTrudeau TCSSDC How fixing agriculture trade issues China India first,4/9/2019 21:18
docstrangelove jimcarrwpg JustinTrudeau TCSSDC This sad,4/9/2019 21:17
jimcarrwpg JustinTrudeau TCSSDC need Canadas standing world stagefire Freeland ,4/9/2019 21:16
jimcarrwpg JustinTrudeau TCSSDC October coming,4/9/2019 21:16
jimcarrwpg JustinTrudeau TCSSDC A little late considering losses imposed China Saudi tarrifs b ,4/9/2019 21:15
jimcarrwpg JustinTrudeau TCSSDC Modernizing Your basically ruining world Hey Rasputin gonna tel ,4/9/2019 21:14
Owt worse losing clicker ya bed man,4/9/2019 21:14
jimcarrwpg JustinTrudeau TCSSDC They China Not possible,4/9/2019 21:13
jimcarrwpg JustinTrudeau TCSSDC How could boost exports outside US You pissed China India Maybe ,4/9/2019 21:11
jimcarrwpg JustinTrudeau TCSSDC You stop making promises wont anything come October ,4/9/2019 21:11
Irving Community Club back TCS Friday designer purse bingo  gets ten chances win beauti ,4/9/2019 21:09
jimcarrwpg JustinTrudeau TCSSDC Love Liberal Vote U ,4/9/2019 21:09
jimcarrwpg JustinTrudeau TCSSDC Let assume none exports Canola oil matter oil period,4/9/2019 21:07
jimcarrwpg JustinTrudeau TCSSDC Its happening I wish increase export Canada n ,4/9/2019 21:06
jimcarrwpg JustinTrudeau TCSSDC Hows  BILLION pipeline bought With taxpayer money Well ,4/9/2019 21:06
closer tcs years song still triggers fight flight response ,4/9/2019 21:06
jimcarrwpg JustinTrudeau TCSSDC How fixing agriculture trade issues China India first,4/9/2019 21:05
Canada These remarkable glasses enable living vision loss see mobile engage virtually ,4/9/2019 21:03
Macken Facebook agrees clearer TampCs Europe  ,4/9/2019 21:02
Professorbroman WWCrowdControl Cough cough mixplay WatchMixer,4/9/2019 21:01
jimcarrwpg JustinTrudeau TCSSDC Can find another country business untill idiots ,4/9/2019 21:01
NETBET Vegas Bonus Up To £ Free Spins New players £ deposit required ewalletsprepaid cards ,4/9/2019 21:00
jrl jimcarrwpg JustinTrudeau TCSSDC Just stop Khadr sued million already Supr ,4/9/2019 21:00
These remarkable glasses enable living vision loss see mobile engage virtually activi ,4/9/2019 21:00
jimcarrwpg JustinTrudeau TCSSDC FBF the allegations false Just first many things Justin T ,4/9/2019 20:59
sentosumosaba TCS IMFNews Have got Hodl power Eri UFUF thanks shout UFDUFD,4/9/2019 20:58
jimcarrwpg JustinTrudeau TCSSDC How get business back China start Or given,4/9/2019 20:56
jimcarrwpg TCSSDC Your government hurt Canadian economy international relationship badly,4/9/2019 20:55
jimcarrwpg JustinTrudeau TCSSDC How going achieve You opposition come October,4/9/2019 20:53
MoiraStormheart Wizard Defeating Mobs Towers reward points limit There point ,4/9/2019 20:45
Canada Min Carr highlights investments help UFEUFEs access new markets new customers amp new jobs How By strengt ,4/9/2019 20:42
Min Carr highlights investments help UFEUFEs access new markets new customers amp new jobs How By strengthening ,4/9/2019 20:42
yes I always Currently Lake Shake June SOSTCS October x,4/9/2019 20:40
fuelingcashton save get close ass seats tour wont sit tcs set,4/9/2019 20:39
RT TCSEurope Laksh Parthasarathy showcased technologies changing future automotive industry years Vehicl,4/9/2019 20:35
jimcarrwpg RBoissonnault TCSSDC Sunny ways coming end fall Thank god ,4/9/2019 20:30
CanadaTrade Great news time inspire CanadaBrazil TCSSDC team way CanEmbMexico brainstorm ,4/9/2019 20:30
Business  Study respondents personalize scale As result firms need focus segment ,4/9/2019 20:30
Transit City CONDOS CenteCourt TCS A brand new preconstruction CONDO Project open NOW Located Vaugh ,4/9/2019 20:19
Facebook agrees clearer TampCs Europe  ,4/9/2019 20:15
CovenantSchoolDallas TAPPSAgolf District champs Way go boys On state next week Congrats Seth Ben ,4/9/2019 20:11
blackcircles KumhoTyreUK UFF WIN Apple iPad courtesy KumhoTyreUK UFF To enter giveaway simply Retweet ,4/9/2019 20:10
This looks like youve worked hard teacher sends principals office These two ,4/9/2019 20:08
Good luck rd th th grade students begin state assessments danadavis seco ,4/9/2019 20:04
 tight angle drive bricks UtcsesportsU,4/9/2019 20:01
Join Team Canada UFEUFE Canadas GlobalEntrepreneur Cohort w UPSSmallBizCA ExportDevCanada amp TCSSDC ,4/9/2019 20:01
RT jonfavs PeterHamby Obama professorial maybe one top criticisms followed throughout entire preside,4/9/2019 20:01
Students Write Theres right wrong way write poetry Use tips ScholasticTeach inspire ,4/9/2019 20:00
RT PeteButtigieg People often polite person advancing policies harm family You polite,4/9/2019 19:58
Canada Min Carr highlights investments help Canadians access new markets new customers amp new jobs How By st ,4/9/2019 19:57
Crazyloc oddinsightstcs mkraju Wrong Mueller Intel community redacting report per test ,4/9/2019 19:55
rwang SAP GCPcloud googlecloud Accenture TCS Infosys Wipro Capgemini IBMServices They become ,4/9/2019 19:48
RT randystiles rwang SAP GCPcloud googlecloud Accenture TCS Infosys Wipro Capgemini IBMServices They partner SAP pu,4/9/2019 19:46
rwang SAP GCPcloud googlecloud Accenture TCS Infosys Wipro Capgemini IBMServices They partner S ,4/9/2019 19:45
ImranKhanPTI Max govt departments amp institutions using private courier services like TCS OCS etcWhy dont ,4/9/2019 19:41
RT secondsofun halsey going collab everyone sos I cant believe stuck tcs ask gold get copper inst,4/9/2019 19:39
MargauxMcDonald gilmourwendy PbitOfficial investinpak TCSSDC Lahore CanHCPakistan Enjoy Food Street,4/9/2019 19:38
MargauxMcDonald gilmourwendy PbitOfficial investinpak TCSSDC Lahore CanHCPakistan These heart part ,4/9/2019 19:37
RT zali shaz Riazhaq ok u please tell tcs using teleportation technologywe digital age type technology,4/9/2019 19:37
 My expectations TCS INFY Q FY Results,4/9/2019 19:36
Learn TCS helping customers fulfill DigitalTransformation journey Pega powered Machine Fir ,4/9/2019 19:36
RoadTrip Lahore gilmourwendy UFUFFA st stop Punjab Board Investment amp Trade Canada fortunate f ,4/9/2019 19:35
Genderequality means increasing market opportunities womenowned businesses Canada US A producti ,4/9/2019 19:34
Its always awesome team see new group students utilizing MajorClarity platform Great work ,4/9/2019 19:32
Canada Min Carr announces  five years funding strengthen amp increase support exporting CdnBiz ,4/9/2019 19:31
Min Carr announces  five years funding strengthen amp increase support exporting CdnBiz wou ,4/9/2019 19:27
RT CanadaTrade SMEs backbone Canadian economy provide private sector jobs We strengthening middle class,4/9/2019 19:26
RT FourSides dcasetcs Sorry ,4/9/2019 19:25
Today Minister jimcarrwpg visited Ottawas tech sector highlight TCSSDC helping companies like ,4/9/2019 19:24
dcasetcs Sorry ,4/9/2019 19:21
RT CanadaTrade Were giving UFEUFE businesses resources tools services links international markets enhance export poten,4/9/2019 19:17
RT lydiadenton  blackcircles h hours ago More UFF WIN Apple iPad courtesy KumhoTyreUK UFF To enter,4/9/2019 19:11
RT AmanGambhir Randhawa Kalai Ananth TCS QNETIndia RNTata There many innocent like us country S,4/9/2019 19:10
RT Randhawa AmanGambhir Kalai Ananth TCS QNETIndia RNTata Same fraud happened,4/9/2019 19:10
A hope someone talks fuck McGeouch done goal,4/9/2019 19:08
cmon know love sos ft tcs way around,4/9/2019 19:08
RT tcsud TCSUD continuing efforts DFRCBlueGold Exec Director Tony Glenn sharing benefits HandinHand helping one another,4/9/2019 19:07
RT TCSEurope Sanjeev Sachdeva gives insight partnerships TCS life sciences companies helping businesses,4/9/2019 19:06
Weve accepted StartupCanada Canadian Global Export Challenge We wait All happening J ,4/9/2019 19:06
OK rewind This Anthos Google going dress likes Accenture TCS Wipro etc Google tshirts ,4/9/2019 19:05
Randhawa Kalai Ananth TCS QNETIndia RNTata There many innocent like us country SaveIndiaBanQnet,4/9/2019 19:04
Dang looking good references two Chers outfits TCS making want ,4/9/2019 19:02
TCS Digital Marketing DigitalMarketing BrandingStrategies ,4/9/2019 19:00
RT tomcrk slide DMs lids ,4/9/2019 18:59
used Gallus TCS ,4/9/2019 18:57
RT EvyCoul Great And UFEUFF company looking information DigitalTransformation energy sector mission UFEUFE,4/9/2019 18:55
YES I studied work ON Excel Sad reality people working TCS I unfortunate ,4/9/2019 18:52
AhmedShehwar MianAhm BeenishSaleem PTIofficial pmlnorg ImranKhanPTI FaisalVawdaPTI TCS service,4/9/2019 18:52
blackcircles UFF WIN Apple iPad courtesy KumhoTyreUK UFF To enter giveaway simply Retweet tweet ,4/9/2019 18:45
Career Exploration th graders BMS today Awesome group kids taking advantage majorclarity ,4/9/2019 18:45
We aim boost UFEUFE exports outside US Were supporting cdnbiz  yrs UUFEF ,4/9/2019 18:41
RT Realsurenk Q Earning Season views Q Results Negative Flat negative ones TCS Negative Margin Pressure R,4/9/2019 18:37
RT SupersSports Don Suzanne average couple got hammered wine coolers bayonet parrot came The,4/9/2019 18:34
Q Earning Season views Q Results Negative Flat negative ones TCS Negative Margin Press ,4/9/2019 18:33
goldengateblond RepTedLieu Its look face priceless You thought I didnt bring receipts ,4/9/2019 18:32
Canada CanadianBiz invited attend TCSSDCs Open House Edmonton Thursday learn ,4/9/2019 18:31
RT MarcyGrossman How earn business UF The MENA Region plenty export opportunities Canadian companies Come join,4/9/2019 18:30
colliscool I find SOS amp tcs show Chicago October Please tell youll,4/9/2019 18:30
Our upcoming TCSInnovation Forum showcase global companies increasingly leveraging combined effec ,4/9/2019 18:30
melaniedeppen Hmmm A wingnut A crank Conspiracy theorist Apologist fascists I could go I think get point UF,4/9/2019 18:27
Great And UFEUFF company looking information DigitalTransformation energy sector mis ,4/9/2019 18:26
ECityRising PranayDubey AbhilashMBLR RandeepDev maniias hdkumaraswamy BBMPMAYOR DrParameshwara ,4/9/2019 18:25
BoSox Dear god I hope Because last two weeks utter shitshow,4/9/2019 18:25
mabehr mkraju Barr Mueller know well Members SCOs office knew well Then tha ,4/9/2019 18:24
keshavmurugesh TCS passportsevamea In case WB police took days submit police verification ,4/9/2019 18:18
Congratulations CanadaGoose opening six new stores Paris Milan Bloomington Toronto Banff ,4/9/2019 18:17
AmanGambhir Kalai Ananth TCS QNETIndia RNTata Same fraud happened,4/9/2019 18:17
Canada Min Carr announces  five years funding strengthen amp increase support exporting Canadia ,4/9/2019 18:16
jamesburrell llucelee Yeah Temenos amp TCS surely dont know,4/9/2019 18:16
PeopleTCS Hello SirMaam We facing numerous problems Exam Portal Due think ,4/9/2019 18:16
Proud partnered AHANewYorkCity STEMGoesRed program high school girls The tcsna ,4/9/2019 18:15
Fatimabutt Address bjo Real wala TCS kr dun UF,4/9/2019 18:15
After review listen lastest episode CheapSeatsPHM discuss impact replay ,4/9/2019 18:14
RT fermatslibrary The Function Dream Sleep published F Crick G Mitchinson They propose REM sleep,4/9/2019 18:11
PranayDubey ECityRising AbhilashMBLR RandeepDev maniias hdkumaraswamy BBMPMAYOR DrParameshwara ,4/9/2019 18:10
FlooringInstallation TCSFlooring Let TCS Flooring handle flooring installation youll see ,4/9/2019 18:08
RT tcsbybloomex Who doesnt love succulents UFD TOMORROW Make succulent arrangement Wed April th PM PM UF Register,4/9/2019 18:07
CallBTVi Whaf view tcs apr ce And ce,4/9/2019 18:06
ECityRising AbhilashMBLR RandeepDev maniias hdkumaraswamy BBMPMAYOR DrParameshwara CentralIfs ,4/9/2019 18:06
Had great lunch Tuscaloosa Christian today The th graders hid camera Also TCS best f ,4/9/2019 18:06
Looking grow tech company markets beyond Canada Apply gain free access Canadian Export Chall ,4/9/2019 18:05
Happy meet today CanHCZA allanequipment SA representative discussing expansion business ,4/9/2019 18:05
Tahira Yes bcz R high class tcs services,4/9/2019 18:04
lordbarrold Its vile mate UF,4/9/2019 18:04
CycloforumsPR DaDaBuh MJVentrice A known GFS bias early spinup TCs I wouldnt worry,4/9/2019 18:04
RT AmanGambhir Kalai Ananth TCS Many fraudulent QNET IRs TCS firing policyThey kee,4/9/2019 18:03
Adambaker Agreed thats manky well,4/9/2019 18:01
A beast bat The MRF Chase Master used endorsed Virat Kohli Stunning piece willow lovel ,4/9/2019 18:00
Library Administrator Jana Hausburg guest TCS week learned Chair Charity reflec ,4/9/2019 18:00
How companies personalizing communications four stages customerlifecycle Find answers th ,4/9/2019 18:00
GautamDesiraju monikahalan narendramodi At least Delhi passport system revamped least years ba ,4/9/2019 17:59
Announcing new STREAM laboratory Lanseria International Airport All made possible TCSGlobal TCS ,4/9/2019 17:59
RT AltamashMurad ASWordsmith ZarlashtFaisal Transfers still small sales Couriers keeping cash days,4/9/2019 17:58
TCS Same marmite,4/9/2019 17:56
ASWordsmith ZarlashtFaisal Transfers still small sales Couriers keeping cash ,4/9/2019 17:55
oddinsightstcs mkraju How would known advance wouldnt agree Not rhetorical Id love ,4/9/2019 17:55
anandmahindra TCS Yes need transformations India passport seva shown possible indigenously,4/9/2019 17:52
Peanut butter absolutely rank way And people scran,4/9/2019 17:48
sahneydeepak TCS something,4/9/2019 17:44
TheGornShip oddinsightstcs mkraju The redacted report mean The redacted report final truth,4/9/2019 17:42
TheGornShip oddinsightstcs mkraju The report redactingso I think hes stupid Only fac ,4/9/2019 17:41
NewsroomGC TCSSDC Seriously Maybe could stop pissing major trading partners sign nafta ,4/9/2019 17:41
TheGornShip oddinsightstcs mkraju Barr actually addressed leaks therefore confirming real,4/9/2019 17:40
JJoully ExpediaGroup Delta TCS goodfynd akshayjain Nearsoft SoftwareDevTool anderpacchioni Hi I ,4/9/2019 17:39
BissaGauravB Ple discuss Above TCS possible,4/9/2019 17:38
Kalai Ananth TCS Many fraudulent QNET IRs TCS firing policyT ,4/9/2019 17:37
Save India Ban QNET Scam narendramodi AmitShahOffice MEAIndia sachinrt RNTata anandmahindra ,4/9/2019 17:34
RT nagusinghrajput Swing Trading TCS Spot Buy Close Above Target STOP LOSS HOLDING TIME,4/9/2019 17:32
Min Carr announces  million five years funding Can Flag strengthen amp increase support export ,4/9/2019 17:29
RT NirmalBang DNA India speaks Nirmal Bangs Research Nifty Index IT sectors Read  Nirma,4/9/2019 17:28
RT TCSEurope One ways TCS help businesses transform promoting awareness latest developments tec,4/9/2019 17:28
Travelball BryanDeHart TCSBB TheCanesBB VaStarsBaseball arsenalbaseball MidAtlShow PGHOutlaws ,4/9/2019 17:28
oddinsightstcs mkraju Or knew dems gonna call cover Mueller didnt job well etc unl ,4/9/2019 17:24
Swing Trading TCS Spot Buy Close Above Target STOP LOSS HOLDING TIME ,4/9/2019 17:22
tiio okay opinion tcs cher dont asshole ,4/9/2019 17:21
RT eliseracicot Very productive alignement meeting fundacao amp earlier APD governopr development agency digital transfo,4/9/2019 17:19
SenKamalaHarris please help give TCs dispatchers recognition deserve supporting Rep ,4/9/2019 17:17
SenFeinstein please help give TCs dispatchers recognition deserve supporting Rep ,4/9/2019 17:17
reppeteaguilar please help give TCs dispatchers recognition deserve supporting Rep ,4/9/2019 17:17
isaacabraham I voted BER least ppl BER agreed needed althou encountered ,4/9/2019 17:13
Summer fun starts JUNE tcsuds Robotics amp Escape camps Register child today UFE ,4/9/2019 17:13
Its Gameday Go Knights ,4/9/2019 17:12
TCSUD continuing efforts DFRCBlueGold Exec Director Tony Glenn sharing benefits HandinHand helping ,4/9/2019 17:11
Guess Indian IT major faced HB rejections ,4/9/2019 17:10
RT TCSBaNCS TCS BaNCS welcomes WFC delegates  ,4/9/2019 17:09
Lot difficulties faced JEEmains aspirants today vadodara centres provided NTA ,4/9/2019 17:07
iitmadras iitbombay TCS Infosysnmurthy ficciindia theicai I request FiX GSTN Only experts ,4/9/2019 17:07
How earn business UF The MENA Region plenty export opportunities Canadian companies Come j ,4/9/2019 17:06
Families TCS school need free clothes welcome Lincoln PreK Ohio Avenue Thurs ,4/9/2019 17:06
oddinsightstcs mkraju The final truth come days hopefully move past delusion,4/9/2019 17:04
Join Sanctuarys TCSNYCMarathon team today  ,4/9/2019 17:04
billboardcharts marshmellomusic bastilledan elliegoulding diplo goSwaeLee CHVRCHES TheChainsmokers SOS ,4/9/2019 17:03
nd grade students growing math skills afternoon Students enjoy flexible seating options le ,4/9/2019 17:00
RT CanadaTrade LIVE Minister Carr takes stage outline UFEUFE helping CdnBiz expand international markets ,4/9/2019 17:00
Looking forward incredible announcement TCSSDC ,4/9/2019 16:57
RT kelekachilka ECityRising PranayDubey AbhilashMBLR RandeepDev maniias hdkumaraswamy BBMPMAYOR DrParameshwara Central,4/9/2019 16:53
AbhilashMBLR AnjanPDubey anilvsblr ECityRising PranayDubey RandeepDev maniias hdkumaraswamy ,4/9/2019 16:53
TCS tcs TradingView ,4/9/2019 16:50
RT KassandraSeven The look get see YachtCocaineProstitutes trending ,4/9/2019 16:49
GNeelesh DilSeRee pradhanpiyush DrGPradhan HMOIndia Wohi issue haionly Infosys tcs grow ,4/9/2019 16:49
TheGornShip mkraju Yes As clear would exactly going back role squashing Iran Contra co ,4/9/2019 16:47
Reematendulkar Reema whats ur take TCS amp Infy results Qtr Will good Disappointment,4/9/2019 16:46
Facebook agrees new TampCs Europe  via TheNiche,4/9/2019 16:45
RT EverestGroup Congratulations Leaders Banking BPO Digital Capability Platform PEAKmatrix Cognizant Genpact TC,4/9/2019 16:43
Fantastic see Staff survey used stimulate conversations lead change Pathology ESHTPathology ,4/9/2019 16:42
priyabratapati DilSeRee pradhanpiyush DrGPradhan HMOIndia So think InfoSys TCS one ,4/9/2019 16:42
isaacabraham Haha TCs fsharp Got clown breakfast,4/9/2019 16:41
The AngelsAthletics loyal us TCSBB Big South Regional Championship since day We welcome ,4/9/2019 16:38
Tata Consultancy Services TCS adopts Ripple Technology  TCS part Tata Group ,4/9/2019 16:36
Facebook agrees new TampCs Europe  ,4/9/2019 16:35
RT getiron  named Top Key Vendor FaaS market devops developers docker containers functions,4/9/2019 16:35
 named Top Key Vendor FaaS market devops developers docker containers ,4/9/2019 16:34
TCS A SHORTING CANDIDATE FOR INTRADAY SWING TCS chart ,4/9/2019 16:32
Though cloud revolution may infancy developed enough see results achieved early adopters Re ,4/9/2019 16:30
Congratulations Leaders Banking BPO Digital Capability Platform PEAKmatrix Cognizant ,4/9/2019 16:30
Learn set Out Office Message Office Watch TCSTechTip  ,4/9/2019 16:30
anandmahindra TCS Ditto Excellent service Delhi passport office All formalities completed within coupl ,4/9/2019 16:28
TCS isnt obvious entry close first small green candle reds stop ,4/9/2019 16:27
HRDMinistry PeopleTCS TataCompanies TCS RNTata TCSNews LabourMinistry Ranjan Your Termination le ,4/9/2019 16:22
RT AnalystQnet Ananth vivekspatil gurupreetanand QnetVictim AmanGambhir Lifebsimple pappu Indian IT compa,4/9/2019 16:19
RT pappu AnalystQnet Ananth vivekspatil gurupreetanand QnetVictim AmanGambhir Lifebsimple Infosys TCS Cogniza,4/9/2019 16:19
RT Ananth pappu Amish AnalystQnet vivekspatil gurupreetanand QnetVictim AmanGambhir Lifebsimple Infosy,4/9/2019 16:18
From last year I using Pakistan post delivery documents goods I totally satisfied ,4/9/2019 16:16
New pay scales glance staff NHS TCS  ,4/9/2019 16:10
What beautiful counterplay zaphare rest ServetteEsports match BenchMasters last ,4/9/2019 16:08
oddinsightstcs TheGornShip mkraju Thats bot block,4/9/2019 16:07
oddinsightstcs mkraju knew coming would partake He also remained mute ,4/9/2019 16:06
FUN FUN FUN UFC A brand new Family Sign event coming Thurs April th TheCreativeStudio RegisterD ,4/9/2019 16:06
LAST CHANCE If youd like personal tour grounds Sudeley Castle simply FOLLOW TheTTGuide ,4/9/2019 16:05
Want win new look Typhoo Tea Of course lucky day Just RT reply ,4/9/2019 16:02
 blackcircles h hours ago More UFF WIN Apple iPad courtesy KumhoTyreUK UFF To ente ,4/9/2019 16:02
On first day Sea Otter WTB unveil two new aggressive TCS Tubeless Compatible System tires enduro ,4/9/2019 16:02
Great ProgrammeSpark launch Spark Innovation Popup Pod stjamesdublin A great initiative ,4/9/2019 16:01
